LEI,Legal Name,Parent LEI,Parent Name,Legal Address,Legal City,Legal Postal Code,HQ Address,HQ City,HQ Postal Code,Registration ID,Registered As,Category,Legal Jurisdiction,Entity Status,Registration Date
30030075HC6DEFH90P50,北京海吉星医疗科技集团有限公司,N/A,N/A,['北京市北京经济技术开发区科创十三街18号院3号楼13层1313'],CN,100000,['北京市北京经济技术开发区科创十三街18号院3号楼13层1313'],CN,100000,RA000092,9111010875874154X5,GENERAL,CN,ACTIVE,2020-03-24T12:42:07Z
30030075PRYEI0RD2B81,府谷县银丰融资担保有限责任公司,N/A,N/A,['陕西省榆林市府谷县新区财税中心九楼'],CN,100000,['陕西省榆林市府谷县新区财税中心九楼'],CN,100000,RA000092,916108226847537827,GENERAL,CN,ACTIVE,2020-04-26T06:07:20Z
30030075G54YVUQSL547,靖江港口集团有限公司,N/A,N/A,['靖江市新港大道99号'],CN,214500,['靖江市新港大道99号'],CN,214500,RA000092,91321282664935642P,GENERAL,CN,ACTIVE,2020-04-22T12:32:08Z
30030075B5MC6KU69L70,平安付电子支付有限公司,N/A,N/A,['区陆家嘴环路1333号35层3509单元'],CN,100000,['区陆家嘴环路1333号35层3509单元'],CN,100000,RA000092,91310115740276838G,GENERAL,CN,ACTIVE,2019-03-25T01:13:00Z
3003007526WLPOAP2J38,武川县千源小额贷款有限公司,N/A,N/A,['呼和浩特市内蒙古自治区呼和浩特市武川县可镇南大街邮政局办公楼内'],CN,100000,['呼和浩特市内蒙古自治区呼和浩特市武川县可镇南大街邮政局办公楼内'],CN,100000,RA000092,91150125695946790K,GENERAL,CN,ACTIVE,2020-04-26T04:45:12Z
30030075GV92TEL44P58,前程物产（香港）有限公司,N/A,N/A,['香港九龙尖沙咀加连威老道2-6号爱宾商业大厦1001-2室'],HK,999077,['仙霞路333号东方维京18楼A1-A2室'],CN,200336,RA000388,C1130933,GENERAL,HK,ACTIVE,2018-07-16T02:38:54Z
30030075JH4T61EN8P46,山西繁峙农村商业银行股份有限公司,N/A,N/A,['繁峙县繁城镇石龙西街113号'],CN,100000,['繁峙县繁城镇石龙西街113号'],CN,100000,RA000092,91140924724611691B,GENERAL,CN,ACTIVE,2019-05-07T16:00:00Z
300300759ZYKP65OA691,宜兴友邦陶瓷有限公司,N/A,N/A,['宜兴市丁蜀镇建新村'],CN,214221,['宜兴市丁蜀镇建新村'],CN,214221,RA000092,91320282685326811T,GENERAL,CN,ACTIVE,2020-09-23T07:25:58Z
30030075COLBW27EIR05,银川滨河黄河大桥管理有限责任公司,N/A,N/A,['区银川市宁夏银川市北京东路1359号'],CN,100000,['区银川市宁夏银川市北京东路1359号'],CN,100000,RA000092,916401000738382343,GENERAL,CN,ACTIVE,2020-05-14T02:48:28Z
30030075WFJMQV7UML69,杭州爱唯生命科技有限公司,N/A,N/A,['浙江省杭州市桐庐县城大奇山路937号'],CN,310000,['浙江省杭州市桐庐县城大奇山路937号'],CN,310000,RA000092,91330122MA27Y1DX8N,GENERAL,CN,ACTIVE,2020-08-17T00:31:23Z
30030075QLKAHJJ0SV89,湖北禾丰粮油集团有限公司,N/A,N/A,['安陆市银杏大道东10号'],CN,430000,['安陆市银杏大道东10号'],CN,430000,RA000092,91420982180968448W,GENERAL,CN,ACTIVE,2020-08-14T06:30:43Z
30030075SFX68XWFCP82,西安航天城投资发展集团有限公司,N/A,N/A,['西安市航天基地神舟四路239号航创广场A座12层'],CN,100000,['西安市航天基地神舟四路239号航创广场A座12层'],CN,100000,RA000092,9161013879749676XP,GENERAL,CN,ACTIVE,2020-03-05T05:39:40Z
30030075SLV0CWWPXQ09,上海市民生律师事务所,N/A,N/A,['福山路450号7楼F/G座'],CN,100000,['福山路450号7楼F/G座'],CN,100000,RA000092,31310000425203663Y,GENERAL,CN,ACTIVE,2020-06-11T00:14:29Z
30030075MAPQKYBOOP67,今新越发展（BVI）有限公司,3003002D6CTKIQ89M426,吉安市井冈山开发区金庐陵经济发展有限公司,['威克汉姆2号礁，里特大厦，邮政信箱3170'],VG,VG1110,['井冈山经济技术开发区深圳大道236号'],CN,343100,RA000063,2031330,GENERAL,VG,ACTIVE,2020-02-18T05:27:14Z
30030075VLXNSHC6WG04,Douyin Group (HK) Limited,54930057HU24VGK3CO92,BYTEDANCE LTD.,"['37/F, One International Finance Centre, 1 Harbour View Street, Central, Hong Kong']",HK,999077,"['37/F, One International Finance Centre, 1 Harbour View Street, Central, Hong Kong']",HK,999077,RA000389,59771830,GENERAL,HK,ACTIVE,2018-07-09T02:14:59Z
30030075XTB2PAJZIH41,无锡山水产业投资发展有限公司,N/A,N/A,['无锡市滨湖区滨湖街道漆塘北村9号'],CN,100000,['无锡市滨湖区滨湖街道漆塘北村9号'],CN,100000,RA000092,91320211726534407E,GENERAL,CN,ACTIVE,2020-03-18T06:22:52Z
300300761O9ZJG7SXC48,天恒（香港）有限公司,N/A,N/A,['九龙九龙湾宏照道38号企业广场5期1座36楼'],HK,999077,['九龙九龙湾宏照道38号企业广场5期1座36楼'],HK,999077,RA000388,C1864310,GENERAL,HK,ACTIVE,2017-07-10T02:06:09Z
30030076AHI1VMT3K759,晋中市左权华丰村镇银行股份有限公司,N/A,N/A,['左权县滨河路东旺综合楼'],CN,100000,['左权县滨河路东旺综合楼'],CN,100000,RA000092,91140700563590251W,GENERAL,CN,ACTIVE,2019-04-04T06:08:47Z
30030076E444P8G7UG76,广东广珠城际轨道交通有限责任公司,N/A,N/A,['广东省广州市海珠区新港东路1000号807房'],CN,100000,['广东省广州市海珠区新港东路1000号807房'],CN,100000,RA000092,914400007657055551,GENERAL,CN,ACTIVE,2020-02-22T07:08:09Z
300300763Q4WLOKZPD04,广汇能源股份有限公司,N/A,N/A,['治区乌鲁木齐市新疆乌鲁木齐市经济技术开发区上海路16号'],CN,100000,['治区乌鲁木齐市新疆乌鲁木齐市经济技术开发区上海路16号'],CN,100000,RA000092,9165000071296668XK,GENERAL,CN,ACTIVE,2020-03-28T02:32:27Z
30030075Z40MI7F8LX16,日照嘉悦工贸有限公司,N/A,N/A,['碑廓镇大朱曹一村'],CN,276809,['碑廓镇大朱曹一村'],CN,276809,RA000092,91371103MA3DC3R26X,GENERAL,CN,ACTIVE,2020-10-14T07:36:44Z
300300760UM7UML58007,全源有限公司,N/A,N/A,['筲箕灣興民街68號海天廣場1701室'],HK,999077,['筲箕灣興民街68號海天廣場1701室'],HK,999077,RA000388,00445190,GENERAL,HK,ACTIVE,2016-07-04T01:20:39Z
3003007688RHDZE0GX93,阳光100中国控股有限公司,N/A,N/A,['纳克斯道1号'],KY,KY1-9005,['光华路2号，阳光100写字楼D座12楼'],CN,100026,RA000086,195527,GENERAL,KY,ACTIVE,2018-05-20T16:00:00Z
30030076G6FXXO6O3K11,中交第二公路工程局有限公司,N/A,N/A,['陕西省西安市雁塔区丈八东路262号'],CN,100000,['陕西省西安市雁塔区丈八东路262号'],CN,100000,RA000092,91610000220521254B,GENERAL,CN,ACTIVE,2020-04-02T08:23:14Z
300300765GLPXV8MSC79,贵阳三联乳业有限公司,N/A,N/A,['贵州省贵阳市乌当区奶牛场'],CN,550000,['贵州省贵阳市乌当区奶牛场'],CN,550000,RA000092,915201007221686062,GENERAL,CN,ACTIVE,2020-06-24T00:20:27Z
30030076PCHBL5HWFB84,济宁高新城建投资有限公司,N/A,N/A,['高新区海川路9号就业促进及科技推广中心A2楼401室'],CN,100000,['高新区海川路9号就业促进及科技推广中心A2楼401室'],CN,100000,RA000092,91370800679215429X,GENERAL,CN,ACTIVE,2019-10-31T07:40:52Z
30030076HKGRCCWZJ031,湖北三行科技股份有限公司,N/A,N/A,['浠水经济开发区散花工业园'],CN,430000,['浠水经济开发区散花工业园'],CN,430000,RA000092,91421100096880902U,GENERAL,CN,ACTIVE,2020-07-13T06:22:32Z
30030076SGK52A4JX851,河南舒莱卫生用品有限公司,N/A,N/A,['许昌市襄城县产业集聚区北二环路东段南侧'],CN,450000,['许昌市襄城县产业集聚区北二环路东段南侧'],CN,450000,RA000092,914110257805286061,GENERAL,CN,ACTIVE,2020-06-24T00:19:25Z
30030076RN6CROI5P798,SWEETLEAF CAPITAL LIMITED,N/A,N/A,"['Commence Chambers,P.O. Box 2208']",VG,VG1110,['永乐路29号新天地休闲广场1号15楼'],CN,214023,RA000063,1952876,GENERAL,VG,ACTIVE,2020-10-08T16:00:00Z
30030076PSPX2UEAVI81,金杯电工股份有限公司,N/A,N/A,['长沙市高新技术产业开发区东方红中路580号'],CN,410000,['长沙市高新技术产业开发区东方红中路580号'],CN,410000,RA000092,914300007607478448,GENERAL,CN,ACTIVE,2020-08-11T00:51:35Z
30030076X9FBFAT30667,靖江市滨江新城投资开发有限公司,N/A,N/A,['靖江市滨江新城区江阳路9号'],CN,100000,['靖江市滨江新城区江阳路9号'],CN,100000,RA000092,913212827673751742,GENERAL,CN,ACTIVE,2020-05-13T06:49:24Z
300300773H7HYRSMCS54,上高县中小企业信用担保有限公司,N/A,N/A,['江西省宜春市上高县朝阳北路41号'],CN,100000,['江西省宜春市上高县朝阳北路41号'],CN,100000,RA000092,91360923060757750X,GENERAL,CN,ACTIVE,2020-04-26T02:52:42Z
300300770TMDM51C6V53,当阳市鑫源投资开发有限责任公司,N/A,N/A,['当阳市玉阳办事处玉阳路127号'],CN,100000,['当阳市玉阳办事处玉阳路127号'],CN,100000,RA000092,91420582726100481N,GENERAL,CN,ACTIVE,2020-05-12T07:44:10Z
3003007725QIXFJ6C113,ORIENTAL PEARL BULK CHARTERING PTE LTD ,N/A,N/A,['152 BEACH RD #14-03'],SG,999002,['152 BEACH RD #14-03'],SG,999002,RA000523,201326171D,GENERAL,SG,ACTIVE,2019-03-29T06:33:23Z
300300770IC78S9WA806,TCL通力科技（香港）有限公司,N/A,N/A,['沙田新界香港科技园区22科学园东大街大厦22E8/F'],CN,999077,['沙田新界香港科技园区22科学园东大街大厦22E8/F'],CN,999077,RA000389,50232063,GENERAL,HK,ACTIVE,2017-10-30T16:00:00Z
30030076YZQP6PMU0P32,北京快乐时代科技发展有限公司,N/A,N/A,['北京市海淀区海淀北二街8号12层1507-3'],CN,100000,['北京市海淀区海淀北二街8号12层1507-3'],CN,100000,RA000092,91110108097174727A,GENERAL,CN,ACTIVE,2020-02-27T02:25:12Z
30030076Y21FIWN1VY24,浙富控股集团股份有限公司,N/A,N/A,['浙江省桐庐县县城迎春南路177号浙富大厦25F'],CN,310000,['浙江省桐庐县县城迎春南路177号浙富大厦25F'],CN,310000,RA000092,91330000759522947D,GENERAL,CN,ACTIVE,2020-08-11T01:02:16Z
30030076TRIY5BMV2E92,天津市融丰小额贷款有限公司,N/A,N/A,['天津市和平区睦南道90号'],CN,100000,['天津市和平区睦南道90号'],CN,100000,RA000092,911201010796291507,GENERAL,CN,ACTIVE,2020-04-26T04:49:11Z
30030076XD97CPD27I48,诺安基金管理有限公司,N/A,N/A,['福田区深南大道4013号兴业银行大厦19层1901-1908室20层2001-2008室'],CN,518048,['福田区深南大道4013号兴业银行大厦19层1901-1908室20层2001-2008室'],CN,518048,RA000092,914403007576004033,FUND,CN,NULL,2017-12-29T05:41:50Z
30030076WPU94X0HKP44,湖北覃姐食品有限公司,N/A,N/A,['枝江市百里洲镇刘巷路'],CN,430000,['枝江市百里洲镇刘巷路'],CN,430000,RA000092,91420583576985340J,GENERAL,CN,ACTIVE,2020-07-20T01:16:01Z
30030077H7O4RM0WAW03,凯泰贸易发展有限公司,N/A,N/A,['九龙尖沙咀加连威老道2-6号爱宾商业大厦'],HK,999077,['江北区人民路132号银亿外滩大厦24楼2401室'],CN,315020,RA000388,C1621447,GENERAL,HK,ACTIVE,2017-10-27T06:40:05Z
30030077IBE5AWFWPP89,北京市长安律师事务所,N/A,N/A,['北京市朝阳区甜水园街6号北京出入境检验检疫大厦14层'],CN,100000,['北京市朝阳区甜水园街6号北京出入境检验检疫大厦14层'],CN,100000,RA000092,31110000E000162318,GENERAL,CN,ACTIVE,2020-06-11T07:20:42Z
30030077DD3ANBC39P36,浙江康绿禽业有限公司,N/A,N/A,['龙游县湖镇镇兰贺公路边'],CN,310000,['龙游县湖镇镇兰贺公路边'],CN,310000,RA000092,91330825099032538W,GENERAL,CN,ACTIVE,2020-07-20T05:43:37Z
300300775WPMMNMIEE25,莱州涌丰新业国际贸易有限公司,N/A,N/A,['莱州市沙河镇佛台子村'],CN,261400,['莱州市沙河镇佛台子村'],CN,261400,RA000092,91370683MA3P4W6963,GENERAL,CN,ACTIVE,2020-09-01T02:14:38Z
30030077DO6JI5XWKG87,云南云天化集团财务有限公司,N/A,N/A,['滇池路1417号2号楼3楼'],CN,100000,['滇池路1417号2号楼3楼'],CN,100000,RA000092,91530000077647005U,GENERAL,CN,ACTIVE,2019-05-31T06:01:03Z
30030077K0RL4L42XL38,扬州锐麟工艺品有限公司,N/A,N/A,['扬州市江都区大桥镇波斯村'],CN,225216,['扬州市江都区大桥镇波斯村'],CN,225216,RA000092,91321012141249125Y,GENERAL,CN,ACTIVE,2020-10-12T06:06:11Z
30030077TA9M8614V356,深圳金丰保险代理有限公司,N/A,N/A,['深圳市龙岗区龙城街道尚景社区龙翔大道9002号志联佳大厦二十层'],CN,100000,['深圳市龙岗区龙城街道尚景社区龙翔大道9002号志联佳大厦二十层'],CN,100000,RA000092,91441300787953285W,GENERAL,CN,ACTIVE,2020-04-24T05:47:29Z
30030077PXFR7ZYU6P56,南平市土地发展集团有限公司,N/A,N/A,['福建省南平市延平新城站前大道1号'],CN,100000,['福建省南平市延平新城站前大道1号'],CN,100000,RA000092,913507005692714548,GENERAL,CN,ACTIVE,2020-02-08T06:38:28Z
300300785RLJKR2AA480,无锡克瑞斯特科技有限公司,N/A,N/A,['新吴区江溪街道南丰工业园B区C-06-02号地块'],CN,214000,['新吴区江溪街道南丰工业园B区C-06-02号地块'],CN,214000,RA000092,91320205774677621Q,GENERAL,CN,ACTIVE,2020-10-13T01:29:58Z
30030077M0STTB7IMU31,山东公用控股有限公司,N/A,N/A,['济宁市红星中路23号'],CN,272000,['济宁市红星中路23号'],CN,272000,RA000092,9137080016593424X9,GENERAL,CN,ACTIVE,2020-03-24T12:39:49Z
300300782IR1H6LDD623,格兰达世纪有限公司,N/A,N/A,"['Vistra (Cayman) Limited, P.O. Box 31119 Grand Pavilion, Hibiscus Way, 802 号 West Bay Road']",KY,KY1-1111,"['Vistra (Cayman) Limited, P.O. Box 31119 Grand Pavilion, Hibiscus Way, 802 号 West Bay Road']",KY,KY1-1111,RA000086,323413,GENERAL,KY,ACTIVE,2018-06-04T16:00:00Z
300300782WWF5S407F78,山东新和盛食品有限公司,N/A,N/A,['潍坊市坊子区黄旗堡镇驻地'],CN,250000,['潍坊市坊子区黄旗堡镇驻地'],CN,250000,RA000092,91370704735761695R,GENERAL,CN,ACTIVE,2020-07-21T02:36:53Z
30030077MH7IV91JF252,江阴茂祥电子材料有限公司,N/A,N/A,['江阴市青阳镇青桐路10号'],CN,214401,['江阴市青阳镇青桐路10号'],CN,214401,RA000092,91320281732268002A,GENERAL,CN,ACTIVE,2020-10-10T07:37:10Z
300300783FEI5B16AA82,安徽诞源禽业有限公司,N/A,N/A,['合肥市瑶海区板桥村龙兴苑小区7号楼门面106室'],CN,230000,['合肥市瑶海区板桥村龙兴苑小区7号楼门面106室'],CN,230000,RA000092,91340100MA2MX4EU6E,GENERAL,CN,ACTIVE,2020-07-20T02:12:52Z
30030077ZY2LPR6KLJ26,香港天逸国际控股有限公司,N/A,N/A,['轩尼斯道48－62号上海实业大厦12楼1201室'],HK,999077,['轩尼斯道48－62号上海实业大厦12楼1201室'],HK,999077,RA000388,C1168111,GENERAL,HK,ACTIVE,2018-12-26T00:14:29Z
30030078AEW8A9DOKX08,福州联众富邦保险代理有限公司,N/A,N/A,['福建省福州市台江区宁化街道上浦路南侧富力中心B区B3#楼12层11商务办公'],CN,100000,['福建省福州市台江区宁化街道上浦路南侧富力中心B区B3#楼12层11商务办公'],CN,100000,RA000092,9135010379179909X1,GENERAL,CN,ACTIVE,2020-04-25T02:00:27Z
30030078E1QAHTQL7Q20,忠县胡燃商行,N/A,N/A,['重庆市忠县忠州街道巴王路35号'],CN,400000,['重庆市忠县忠州街道巴王路35号'],CN,400000,RA000092,91500233572113457E,GENERAL,CN,ACTIVE,2020-07-13T03:03:53Z
30030078HPJKKOU4GB35,青岛浪淘金资产管理有限公司,N/A,N/A,['闽江路2号2单元1401'],CN,266000,['闽江路2号2单元1401'],CN,266000,RA000092,913702020610893957,GENERAL,CN,ACTIVE,2018-10-11T08:27:04Z
30030078BVS79T51VR04,日照海星针织服装有限公司,N/A,N/A,['日照开发区玉溪路109号'],CN,276800,['日照开发区玉溪路109号'],CN,276800,RA000092,913711001683838850,GENERAL,CN,ACTIVE,2020-09-08T00:24:27Z
30030078EC56B1FTC080,勉县农村信用合作联社,N/A,N/A,['勉县勉阳镇和平路东'],CN,100000,['勉县勉阳镇和平路东'],CN,100000,RA000092,916107252227336053,GENERAL,CN,ACTIVE,2019-04-10T01:39:22Z
30030078PMMN3CG4FM43,深圳泛华联合投资集团有限公司,N/A,N/A,['深圳市罗湖区东门街道深圳市罗湖区深南东路2028号罗湖商务中心19楼01B单元'],CN,100000,['深圳市罗湖区东门街道深圳市罗湖区深南东路2028号罗湖商务中心19楼01B单元'],CN,100000,RA000092,91440300792558992W,GENERAL,CN,ACTIVE,2020-01-22T06:07:26Z
30030078O0JIGSCO6D50,郑州新郑综合保税区天成小额贷款有限公司,N/A,N/A,['郑州航空港区云港路北侧润丰水尚16号楼1层107号'],CN,100000,['郑州航空港区云港路北侧润丰水尚16号楼1层107号'],CN,100000,RA000092,9141010006135489X6,GENERAL,CN,ACTIVE,2020-04-26T04:39:15Z
30030078II1ZY1RM2703,上海交大慧谷信息产业股份有限公司,N/A,N/A,['上海市桂平路471号7号楼2楼'],CN,100000,['上海市桂平路471号7号楼2楼'],CN,100000,RA000092,91310000631898726W,GENERAL,CN,ACTIVE,2020-02-26T07:38:04Z
30030078MH4MU52W0L75,浙江省三门海之蓝农业开发有限公司,N/A,N/A,['浙江省三门县沙柳街道船帮里村'],CN,310000,['浙江省三门县沙柳街道船帮里村'],CN,310000,RA000092,91331022554753645C,GENERAL,CN,ACTIVE,2020-07-20T05:39:49Z
30030078JTWEHBM0V412,日照海通丝业有限公司,N/A,N/A,['东港区海曲西路92号'],CN,276800,['东港区海曲西路92号'],CN,276800,RA000092,913711027563991975,GENERAL,CN,ACTIVE,2020-08-26T01:48:11Z
30030078UJUAZMZBST58,振华物流集团有限公司,N/A,N/A,['天津经济技术开发区第二大街62号MSD-B1座9层'],CN,300000,['天津经济技术开发区第二大街62号MSD-B1座9层'],CN,300000,RA000092,91120116600575801R,GENERAL,CN,ACTIVE,2020-07-13T06:49:06Z
30030078K88U6ZHXUQ59,德田丰新材料江苏有限公司,N/A,N/A,['高邮市城南经济新区新区路'],CN,225600,['高邮市城南经济新区新区路'],CN,225600,RA000092,91321084MA1W9H7WXJ,GENERAL,CN,ACTIVE,2020-10-12T05:27:27Z
30030078UT7W5UP1C538,苏州伦科思电子科技有限公司,N/A,N/A,['苏州工业园区仁爱路150号'],CN,215123,['苏州工业园区仁爱路150号'],CN,215123,RA000092,913205945580874917,GENERAL,CN,ACTIVE,2020-04-17T00:56:01Z
30030078Q1SGBEZW3P05,河南东龙控股集团有限公司,N/A,N/A,['郑州市郑东新区熊儿河路与才高街交叉口河南卫群大厦2#楼5－6层'],CN,100000,['郑州市郑东新区熊儿河路与才高街交叉口河南卫群大厦2#楼5－6层'],CN,100000,RA000092,91410000555737620L,GENERAL,CN,ACTIVE,2020-02-19T02:55:58Z
30030078ZQ8AVKOGJS80,无锡双欢重工制造有限公司,N/A,N/A,['惠山区洛社镇张镇工业园区10号'],CN,214187,['惠山区洛社镇张镇工业园区10号'],CN,214187,RA000092,913202067040707282,GENERAL,CN,ACTIVE,2020-09-08T00:12:16Z
30030078YRX049I31P32,深圳国梁商业保理有限公司,N/A,N/A,['深圳市前海深港合作区前湾一路1号A栋201室（入驻深圳市前海商务秘书有限公司）'],CN,100000,['深圳市前海深港合作区前湾一路1号A栋201室（入驻深圳市前海商务秘书有限公司）'],CN,100000,RA000092,91440300MA5DT82Q3J,GENERAL,CN,ACTIVE,2020-02-08T06:21:52Z
30030079491TOFYTNE79,成都天府新区投资集团有限公司,N/A,N/A,['中国（四川）自由贸易试验区成都市天府新区湖畔路北段269号'],CN,610042,['天府新区湖畔路北段269号'],CN,610042,RA000092,9151010007538378X1,GENERAL,CN,ACTIVE,2019-03-14T02:19:51Z
30030078NWU3B2MOYU27,中国五环工程有限公司,300300PQKHJ03AUIIX32,中国化学工程股份有限公司,['武汉市东湖新技术开发区民族大道1019号长城科技园'],CN,430223,['武汉市东湖新技术开发区民族大道1019号长城科技园'],CN,430223,RA000092,91420100177672304J,GENERAL,CN,ACTIVE,2020-06-02T08:40:05Z
300300791AJ2Y93QUW69,国投瑞银资产管理（香港）有限公司,3003000YREV5PFVQ3X64,国投瑞银基金管理有限公司,['中环康乐广场8号交易广场一座39楼'],HK,999077,['中环康乐广场8号交易广场一座39楼'],HK,999077,RA000388,C1552235,GENERAL,HK,ACTIVE,2018-02-05T08:20:19Z
30030078XA89JNN1M398,道普化学有限公司,8368000M7CW7TIHUBP43,浙江明日控股集团股份有限公司,['香港金钟道189号力宝中心大厦19楼08-09室'],HK,999077,['滨江区江虹路768号浙农科创园3号楼6层'],CN,310052,RA000389,5023330200001234,GENERAL,HK,ACTIVE,2017-12-11T08:03:00Z
300300798CI25VMMBL89,乳山华信食品有限公司,N/A,N/A,['乳山市经济开发区创业二路77号'],CN,264500,['乳山市经济开发区创业二路77号'],CN,264500,RA000092,91371083580444862H,GENERAL,CN,ACTIVE,2020-09-01T00:32:16Z
3003007955VBP17FSF71,福建仙游瑞狮村镇银行股份有限公司,N/A,N/A,['仙游县世纪南路北侧兰鑫花园'],CN,100000,['仙游县世纪南路北侧兰鑫花园'],CN,100000,RA000092,91350300084341645Q,GENERAL,CN,ACTIVE,2019-04-08T02:19:41Z
30030079ISXMOCM25S40,甜橙保险代理有限公司,N/A,N/A,['陕西省西安市高新区科技二路72号西安软件园零壹广场裙楼三层'],CN,100000,['陕西省西安市高新区科技二路72号西安软件园零壹广场裙楼三层'],CN,100000,RA000092,91610000052122448T,GENERAL,CN,ACTIVE,2020-04-25T01:55:27Z
30030079QXH2YPG4MZ79,杭州优尼克消毒设备有限公司,N/A,N/A,['浙江省杭州市余杭区仁和街道獐山路220号1-3幢'],CN,310000,['浙江省杭州市余杭区仁和街道獐山路220号1-3幢'],CN,310000,RA000092,91330110679856883Q,GENERAL,CN,ACTIVE,2020-06-22T01:07:40Z
30030079PLH778VB3989,亳州市新健康科技有限公司,N/A,N/A,['亳州市现代中药产业创业基地B区10#B座'],CN,230000,['亳州市现代中药产业创业基地B区10#B座'],CN,230000,RA000092,91341600MA2MRFA7X1,GENERAL,CN,ACTIVE,2020-05-27T04:54:06Z
30030079QY2GZ9CL7193,无锡广播电视发展有限公司,N/A,N/A,['无锡市湖滨路4号'],CN,100000,['无锡市湖滨路4号'],CN,100000,RA000092,91320200135935989L,GENERAL,CN,ACTIVE,2020-05-13T06:21:54Z
30030079NO473Q1FCD70,吉林省富隆保险代理有限公司,N/A,N/A,['吉林省长春市南关区长春大街621号荟冠大厦（原115号）正荣大厦十四层'],CN,100000,['吉林省长春市南关区长春大街621号荟冠大厦（原115号）正荣大厦十四层'],CN,100000,RA000092,9122010477109317XE,GENERAL,CN,ACTIVE,2020-04-23T12:34:55Z
30030079RYZNE27Q3N34,乌鲁木齐市天融小额贷款有限责任公司,N/A,N/A,['治区乌鲁木齐市乌鲁木齐市天山区新华北路108号红山新世纪写字楼11层A-4、A-5'],CN,100000,['治区乌鲁木齐市乌鲁木齐市天山区新华北路108号红山新世纪写字楼11层A-4、A-5'],CN,100000,RA000092,9165010059915227XW,GENERAL,CN,ACTIVE,2019-12-02T00:30:51Z
300300798UYCAEH7ES98,中国工商银行股份有限公司上海市分行,N/A,N/A,['区中国（上海）自由贸易试验区浦东大道9号'],CN,100000,['区中国（上海）自由贸易试验区浦东大道9号'],CN,100000,RA000092,91310000132206043P,GENERAL,CN,ACTIVE,2019-09-26T02:57:22Z
30030079EMAD7GA50886,南雄市香溢工贸有限公司,N/A,N/A,['南雄市黄坑镇原粮管所'],CN,510000,['南雄市黄坑镇原粮管所'],CN,510000,RA000092,914402826771399604,GENERAL,CN,ACTIVE,2020-06-23T07:56:18Z
30030079X8GJ2Z3RIM15,北京物美商业集团股份有限公司,N/A,N/A,['区北京市石景山区实兴大街30号院3号楼8层8039房间'],CN,100000,['区北京市石景山区实兴大街30号院3号楼8层8039房间'],CN,100000,RA000092,9111000072261280XB,GENERAL,CN,ACTIVE,2020-03-26T15:01:41Z
30030079Y7Y7FER1F035,广东顺德农村商业银行股份有限公司大良支行,N/A,N/A,['佛山市顺德区大良凤山中路三十八号'],CN,100000,['佛山市顺德区大良凤山中路三十八号'],CN,100000,RA000092,914406066649951357,GENERAL,CN,ACTIVE,2020-01-21T07:02:21Z
3003007A7T3XPRQJCG91,广西贵港农村商业银行股份有限公司,N/A,N/A,['区贵港市港北区南苑街98号'],CN,100000,['区贵港市港北区南苑街98号'],CN,100000,RA000092,914508002004516741,GENERAL,CN,ACTIVE,2019-03-27T07:03:34Z
3003007AB2KZ1PRS2767,瓦锡兰船用设备（苏州）有限公司,N/A,N/A,['高新区鸿禧路77号'],CN,215151,['高新区鸿禧路77号'],CN,215151,RA000092,91320505704081013R,GENERAL,CN,ACTIVE,2017-12-28T07:54:05Z
3003007A2GAB0VNJAA25,陕西关天保险代理有限公司,N/A,N/A,['陕西省西安市高新区丈八街办高新路2号西部国际广场西座8层'],CN,100000,['陕西省西安市高新区丈八街办高新路2号西部国际广场西座8层'],CN,100000,RA000092,916100005902844608,GENERAL,CN,ACTIVE,2020-04-24T06:10:14Z
3003007AJ8LJ816EZ692,营口银行股份有限公司,N/A,N/A,['站前区市府路北1号、北3号'],CN,115000,['站前区市府路北1号、北3号'],CN,115000,RA000092,91210800121238672R,GENERAL,CN,ACTIVE,2019-03-29T00:53:19Z
3003007AKPXT16OVG826,华夏银行股份有限公司上海自贸试验区分行,N/A,N/A,['区中国(上海)自由贸易试验区台中南路2号207室'],CN,100000,['区中国(上海)自由贸易试验区台中南路2号207室'],CN,100000,RA000092,9131000032442212XL,GENERAL,CN,ACTIVE,2020-05-08T06:10:34Z
3003007AL9H5W0NBAQ95,大连万大源食品有限公司,N/A,N/A,['经济技术开发区大李家石槽村'],CN,116600,['经济技术开发区大李家石槽村'],CN,116600,RA000092,912102137920150823,GENERAL,CN,ACTIVE,2019-05-17T02:10:29Z
3003007AFO1PNQ2UIW19,河南福森药业有限公司,N/A,N/A,['淅川县金河开发区'],CN,450000,['淅川县金河开发区'],CN,450000,RA000092,91411326753898564K,GENERAL,CN,ACTIVE,2020-05-24T01:51:06Z
3003007AMX0HGCCHIE73,金隆铜业有限公司,N/A,N/A,['安徽省铜陵市金山路'],CN,100000,['安徽省铜陵市金山路'],CN,100000,RA000092,91340700610436303R,GENERAL,CN,ACTIVE,2020-05-09T07:27:00Z
3003007AEP1KRT321U18,沈阳金山能源股份有限公司,N/A,N/A,['沈阳市苏家屯区迎春街２号'],CN,100000,['沈阳市苏家屯区迎春街２号'],CN,100000,RA000092,91210100711107373Q,GENERAL,CN,ACTIVE,2020-03-09T00:55:22Z
3003007AB8HXT4WSXB93,南通瑞特建筑材料有限公司,N/A,N/A,['江苏省启东市惠萍镇东兴镇村8号'],CN,226200,['江苏省启东市惠萍镇东兴镇村8号'],CN,226200,RA000092,91320681692590944J,GENERAL,CN,ACTIVE,2020-08-21T05:47:22Z
