LEI,Legal Name,Parent LEI,Parent Name,Legal Address,Legal City,Legal Postal Code,HQ Address,HQ City,HQ Postal Code,Registration ID,Registered As,Category,Legal Jurisdiction,Entity Status,Registration Date
30030055Q8ZVY9QM8Q60,桐庐县国有资产投资经营有限公司,N/A,N/A,['桐庐县城迎春南路258号27层'],CN,100000,['桐庐县城迎春南路258号27层'],CN,100000,RA000092,913301227345100850,GENERAL,CN,ACTIVE,2020-02-22T07:12:37Z
30030056HJYXFUBHB496,鑫源易网（大连）电力科技有限公司,N/A,N/A,['自由贸易试验区大连保税区海富路9-1号4637室'],CN,116600,['中山区七七街73号（三区20号）'],CN,116001,RA000092,91210242MA0UXDK4XB,GENERAL,CN,ACTIVE,2018-08-03T06:27:27Z
30030056NOD0HZBMYW13,大连市普兰店区建设投资有限公司,N/A,N/A,['辽宁省大连市普兰店区商业大街206号'],CN,100000,['辽宁省大连市普兰店区商业大街206号'],CN,100000,RA000092,91210200751591462C,GENERAL,CN,ACTIVE,2020-05-13T16:00:00Z
30030055TN4S93QWJO90,中钢国际控股有限公司,300300IHVILZSM16NV32,中国中钢股份有限公司,['湾仔港湾道23号鹰君中心26楼'],HK,999077,['湾仔港湾道23号鹰君中心26楼'],HK,999077,RA000389,35998109,GENERAL,HK,ACTIVE,2017-12-26T09:25:23Z
30030056B8W0N9ND4O97,中国国际贸易中心有限公司,N/A,N/A,['北京市朝阳区建国门外大街一号'],CN,100000,['北京市朝阳区建国门外大街一号'],CN,100000,RA000092,91110000625906195N,GENERAL,CN,ACTIVE,2020-02-18T06:09:36Z
30030056P5BEUFIKLS38,澳門國際銀行股份有限公司,300300C1078135000028,厦门国际银行股份有限公司,['澳門蘇亞利斯博士大馬路'],MO,999078,['澳門蘇亞利斯博士大馬路'],CN,999078,RA000436,SO 733,GENERAL,MO,ACTIVE,2017-11-17T02:48:06Z
30030056PB7Y7HMHVN58,中信银行国际（中国）有限公司,54930034UPFJV0NHXV95,China CITIC Bank International Limited,['罗湖区桂园街道人民币桥社区深南东路5001号华润大厦6楼601-602、606单元及11楼1101-1103单元'],CN,518001,['罗湖区桂园街道人民币桥社区深南东路5001号华润大厦6楼601-602、606单元及11楼1101-1103单元'],CN,518001,RA000092,91440300618900991W,GENERAL,CN,ACTIVE,2019-03-28T07:52:12Z
30030057EILHMWCAH757,贵阳市城市建设投资集团有限公司,N/A,N/A,['贵州省贵阳市观山湖区杭州路1号贵阳西南国际商贸城2-G栋'],CN,100000,['贵州省贵阳市观山湖区杭州路1号贵阳西南国际商贸城2-G栋'],CN,100000,RA000092,91520100688437904C,GENERAL,CN,ACTIVE,2020-03-28T02:38:12Z
30030057H5RDGZ23MC87,烟台三嘉粉丝有限公司,N/A,N/A,['山东省烟台市招远市张星镇张西村北'],CN,265403,['山东省烟台市招远市张星镇张西村北'],CN,265403,RA000092,91370685MA3MJD1759,GENERAL,CN,ACTIVE,2020-09-09T00:12:31Z
30030056Z1UBT71M3914,江西南芳律师事务所,N/A,N/A,['江西省赣州市章贡区章江北大道111号'],CN,100000,['江西省赣州市章贡区章江北大道111号'],CN,100000,RA000092,31360000767018097E,GENERAL,CN,ACTIVE,2020-06-17T00:21:06Z
30030056RWS8XH5DIC68,德瑞斯船用产品（大连）有限公司,N/A,N/A,['辽宁省大连市甘井子区大连湾街道土城子村'],CN,116034,['辽宁省大连市甘井子区大连湾街道土城子村'],CN,116034,RA000092,91210200679962985Q,GENERAL,CN,INACTIVE,2018-03-28T08:05:58Z
300300570T8QDBTISQ62,连城县农村信用合作联社,N/A,N/A,['连城县莲峰镇北大东路64号（百花金城小区1号楼）'],CN,366200,['连城县莲峰镇北大东路64号（百花金城小区1号楼）'],CN,366200,RA000092,913508257053291561,GENERAL,CN,ACTIVE,2019-04-12T00:17:05Z
30030057BNZ5R1RUEV45,日照长金贸易有限公司,N/A,N/A,['经济技术开发区天津路29号'],CN,276800,['经济技术开发区天津路29号'],CN,276800,RA000092,91371100MA3C74KMX9,GENERAL,CN,ACTIVE,2020-08-26T07:28:32Z
30030056V61BOUVSLP57,郑州投资控股有限公司,N/A,N/A,['嵩山南路1号'],CN,450000,['中原区华山路78号二砂文创园内51号楼'],CN,450000,RA000092,91410100780545414U,GENERAL,CN,ACTIVE,2020-03-17T12:14:29Z
30030057M7OFVTK7FI48,中盐吉兰泰盐化集团有限公司,N/A,N/A,['阿拉善盟内蒙古自治区阿拉善盟阿拉善经济开发区（乌斯太镇）贺兰区人民路中盐综合科技楼'],CN,100000,['阿拉善盟内蒙古自治区阿拉善盟阿拉善经济开发区（乌斯太镇）贺兰区人民路中盐综合科技楼'],CN,100000,RA000092,911529001174447212,GENERAL,CN,ACTIVE,2020-02-27T07:31:53Z
30030057ZMUJVD4CT203,重庆建峰工业集团有限公司,N/A,N/A,['重庆市涪陵区白涛街道办事处'],CN,100000,['重庆市涪陵区白涛街道办事处'],CN,100000,RA000092,915000002032962518,GENERAL,CN,ACTIVE,2020-05-15T07:56:26Z
30030057RLP6PKVRXI12,响水县小尖建筑工程有限责任公司,N/A,N/A,['响水县小尖镇307路'],CN,224600,['响水县小尖镇307路'],CN,224600,RA000092,913209217287025314,GENERAL,CN,ACTIVE,2020-08-24T06:01:53Z
30030057WBA92MTZD822,中国船舶重工集团有限公司,N/A,N/A,['北京市海淀区昆明湖南路72号'],CN,100000,['北京市海淀区昆明湖南路72号'],CN,100000,RA000092,9111000071092446XA,GENERAL,CN,ACTIVE,2020-04-22T12:01:13Z
3003005838QFWAQI3H83,东营市汇东商贸有限公司,N/A,N/A,['山东省东营市垦利区胜坨镇镇北路以北'],CN,100000,['山东省东营市垦利区胜坨镇镇北路以北'],CN,100000,RA000092,913705216848204206,GENERAL,CN,ACTIVE,2020-04-03T23:56:12Z
30030056UFFCCW79KL18,妥思空调设备（苏州）有限公司,529900QQ6S6H2FYA5B93,TROX GmbH,['工业园区阳澄湖大道创投工业坊46幢'],CN,215021,['工业园区阳澄湖大道创投工业坊46幢'],CN,215021,RA000092,91320594729309176J,GENERAL,CN,ACTIVE,2017-12-13T07:17:46Z
30030056TCFNXWDFCW54,河北开元大正文化传播有限公司,N/A,N/A,['市石家庄市广安街36号时代方舟B-701号'],CN,100000,['市石家庄市广安街36号时代方舟B-701号'],CN,100000,RA000092,91130100663690065R,GENERAL,CN,ACTIVE,2020-06-02T06:22:14Z
300300572L5XY70SQ657,河南黑马动物药业有限公司,N/A,N/A,['禹州市经济技术开发区'],CN,450000,['禹州市经济技术开发区'],CN,450000,RA000092,9141108167670004X1,GENERAL,CN,ACTIVE,2020-08-20T07:21:09Z
30030058DM2Z8VB83F22,株洲市城市建设发展集团有限公司,N/A,N/A,['天元区联谊路86号'],CN,412000,['天元区联谊路86号'],CN,412000,RA000092,914302007506103774,GENERAL,CN,ACTIVE,2019-03-19T07:56:23Z
30030058EWFJ2O4WVV55,浙江开山压缩机股份有限公司,N/A,N/A,['浙江省衢州市经济开发区凯旋西路9号'],CN,310000,['浙江省衢州市经济开发区凯旋西路9号'],CN,310000,RA000092,9133000074100296XK,GENERAL,CN,ACTIVE,2020-08-11T01:14:54Z
30030058FNCCOW1HKS62,英大长安保险经纪有限公司,N/A,N/A,['北京市东城区建国门内大街乙18号院1号楼4层'],CN,100000,['北京市东城区建国门内大街乙18号院1号楼4层'],CN,100000,RA000092,91110000770401775C,GENERAL,CN,ACTIVE,2020-04-25T00:54:33Z
30030058ABOZ1CFFFU23,时和资产管理有限公司,N/A,N/A,['上环德辅道中188号金龙中心2303室'],HK,999077,['上环德辅道中188号金龙中心2303室'],HK,999077,RA000388,66836241,GENERAL,HK,ACTIVE,2018-02-01T02:54:57Z
300300583N4YIUUU2W61,天蓝颜料（山东）有限公司,N/A,N/A,['龙口市经济开发区环海北路北侧'],CN,265700,['龙口市经济开发区环海北路北侧'],CN,265700,RA000092,91370681559903518U,GENERAL,CN,ACTIVE,2020-10-15T00:42:26Z
30030058G3ET8CYYJU86,ICBC Investment Funds SPC - ICBC US$ Enhanced Liquidity Fund SP,N/A,N/A,['PO Box 309 Ugland House'],KY,KY1-1104,"['Unit 2507-10, 25/F', 'ICBC Tower']",HK,,RA999999,,GENERAL,KY,ACTIVE,2018-05-07T07:47:43Z
300300584L6WQTAC7W21,云南民族文化旅游产业有限公司,N/A,N/A,['昆明市度假区滇池路怡景园度假酒店中心副楼1507室'],CN,100000,['昆明市度假区滇池路怡景园度假酒店中心副楼1507室'],CN,100000,RA000092,915301000569802711,GENERAL,CN,ACTIVE,2020-03-29T04:50:58Z
30030058B6J55TBMLI79,茂名市交通建设投资集团有限公司,N/A,N/A,['茂名市迎宾路53号'],CN,100000,['茂名市迎宾路53号'],CN,100000,RA000092,91440900725974910E,GENERAL,CN,ACTIVE,2020-05-11T06:10:22Z
30030058IZZ40YZFOP24,豫粮集团延津小麦产业有限公司,N/A,N/A,['延津县产业集聚区'],CN,450000,['延津县产业集聚区'],CN,450000,RA000092,91410726MA3XFMYF3U,GENERAL,CN,ACTIVE,2020-08-14T05:32:06Z
30030058CUW9N2S3SS38,深圳市赛格集团有限公司,N/A,N/A,['深圳市福田区华强北路2号赛格广场61-62楼'],CN,100000,['深圳市福田区华强北路2号赛格广场61-62楼'],CN,100000,RA000092,91440300192180930F,GENERAL,CN,ACTIVE,2020-03-12T05:07:32Z
30030058TI9R2EEE8L24,乐清市运输集团有限公司,N/A,N/A,['浙江省乐清市乐成街道宁康西路19号'],CN,310000,['浙江省乐清市乐成街道宁康西路19号'],CN,310000,RA000092,91330382145498153W,GENERAL,CN,ACTIVE,2020-04-28T00:34:47Z
30030058TJWZAIMYY149,北京市金栋律师事务所,N/A,N/A,['北京市朝阳区东三环北路2号南银大厦608室'],CN,100000,['北京市朝阳区东三环北路2号南银大厦608室'],CN,100000,RA000092,31110000765506855R,GENERAL,CN,ACTIVE,2020-06-15T01:18:24Z
30030058UE7AOVHCVZ23,長安資本管理有限公司,N/A,N/A,['湾仔港湾道18号中环广场21楼2103-04室'],HK,999077,['湾仔港湾道18号中环广场21楼2103-04室'],HK,999077,RA000388,64838128,GENERAL,HK,ACTIVE,2017-12-21T08:08:00Z
30030058Z1PBMIFW8S15,苏州泛普科技股份有限公司,N/A,N/A,['苏州工业园区星湖街218号生物纳米园C22楼'],CN,215000,['苏州工业园区星湖街218号生物纳米园C22楼'],CN,215000,RA000092,913205945558917751,GENERAL,CN,ACTIVE,2020-08-11T07:09:55Z
300300591CYHTWY3TZ45,山西长城微光器材股份有限公司,N/A,N/A,['山西示范区电子街7号'],CN,100000,['山西示范区电子街7号'],CN,100000,RA000092,9114000072590383XL,GENERAL,CN,ACTIVE,2020-02-26T07:38:41Z
30030059IU9E9B2J5G98,内蒙古盈科化工有限公司,N/A,N/A,['海勃湾区海北东街37-9号'],CN,016000,['海勃湾区海北东街37-9号'],CN,016000,RA000092,91150300MA0Q8YM82U,GENERAL,CN,INACTIVE,2020-08-20T02:30:35Z
300300594NGAMIKBG558,江苏句容福地生态科技有限公司,N/A,N/A,['句容市华阳镇华阳东路16号'],CN,100000,['句容市华阳镇华阳东路16号'],CN,100000,RA000092,91321183799093948X,GENERAL,CN,ACTIVE,2020-05-13T07:05:20Z
30030059MO28LEE9TC36,吉利喜（宜昌）进出口贸易有限公司,N/A,N/A,['中国(湖北)自贸区宜昌片区发展大道57-5号'],CN,443000,['中国(湖北)自贸区宜昌片区发展大道57-5号'],CN,443000,RA000092,91420500MA494J946E,GENERAL,CN,ACTIVE,2020-08-05T03:05:24Z
30030059DMZIV1V71A11,苏州工业园区安诺科斯化妆品研发有限公司,N/A,N/A,['苏州工业园区星龙街428号苏春工业坊标准厂房第（11B&C）单位'],CN,215000,['苏州工业园区星龙街428号苏春工业坊标准厂房第（11B&C）单位'],CN,215000,RA000092,913205945837048774,GENERAL,CN,ACTIVE,2020-08-11T07:16:04Z
30030059MNVLO4EYB059,湖南津市湘淮村镇银行股份有限公司,N/A,N/A,['津市津澧大道998号'],CN,100000,['津市津澧大道998号'],CN,100000,RA000092,91430700MA4LLKXH1U,GENERAL,CN,ACTIVE,2019-05-08T05:32:35Z
30030059JUZMNGQWKB11,江苏华靖资产经营有限公司,N/A,N/A,['江苏省靖江市口岸联检服务中心1幢7楼'],CN,214599,['江苏省靖江市口岸联检服务中心1幢7楼'],CN,214599,RA000092,913212827301007831,GENERAL,CN,ACTIVE,2020-03-13T06:37:31Z
300300591HRC2GZ6RW93,北京新投前程供应链管理有限公司,N/A,N/A,['北京市西城区百万庄大街16号8号楼2层8236室'],CN,100000,['北京市西城区百万庄大街16号8号楼2层8236室'],CN,100000,RA000092,91110102MA01Q32F3R,GENERAL,CN,ACTIVE,2020-08-13T05:59:15Z
300300597UQNFTD2YZ18,"LYNC Global Co.,Ltd",N/A,N/A,"['35 Ivor Place,Lower Ground']",GB,NW16EA,"['35 Ivor Place,Lower Ground']",GB,NW16EA,RA000585,10452425,GENERAL,GB,INACTIVE,2017-12-12T16:00:00Z
300300596ILHGI3RIB06,中都物流有限公司,N/A,N/A,['北京市顺义区仁和镇顺强路2号'],CN,100000,['北京市顺义区仁和镇顺强路2号'],CN,100000,RA000092,91110113670553691Q,GENERAL,CN,ACTIVE,2020-08-18T03:00:40Z
300300591P28MN6FBP40,前海国铭商业保理（深圳）有限公司,N/A,N/A,['深圳市前海深港合作区前湾一路1号A栋201室（入驻深圳市前海商务秘书有限公司）'],CN,100000,['深圳市前海深港合作区前湾一路1号A栋201室（入驻深圳市前海商务秘书有限公司）'],CN,100000,RA000092,91440300MA5DLGXH56,GENERAL,CN,ACTIVE,2020-02-03T02:25:05Z
30030059MU9DU51H2U03,云南银通支付管理有限公司,N/A,N/A,['五华区人民中路都市名园A座2301号'],CN,100000,['五华区人民中路都市名园A座2301号'],CN,100000,RA000092,91530103683668914H,GENERAL,CN,ACTIVE,2019-03-30T15:18:51Z
30030059VH5B2MONMT82,江苏双良科技有限公司,N/A,N/A,['江阴市临港街道西利路115号301室'],CN,100000,['江阴市临港街道西利路115号301室'],CN,100000,RA000092,91320281713260785U,GENERAL,CN,ACTIVE,2020-03-24T04:16:45Z
30030059PLLCAUPML503,中航国际成套设备有限公司,N/A,N/A,['宏达北路16号3号楼306'],CN,100000,['宏达北路16号3号楼306'],CN,100000,RA000092,9111030257524687XY,GENERAL,CN,ACTIVE,2018-09-04T11:54:26Z
30030059T7EXUJ6HAM19,上海乐易信息技术有限公司,N/A,N/A,['崇明区城桥镇东河沿68号6号楼323室（上海城桥经济开发区）'],CN,100000,['崇明区城桥镇东河沿68号6号楼323室（上海城桥经济开发区）'],CN,100000,RA000092,91310230551563408E,GENERAL,CN,ACTIVE,2019-03-25T06:45:47Z
30030059RB6EU8RPAR09,福建东南艺术纸品股份有限公司,N/A,N/A,['莆田市华林经济开发区(城厢区华亭镇山牌村'],CN,350000,['莆田市华林经济开发区(城厢区华亭镇山牌村'],CN,350000,RA000092,91350300X11300033H,GENERAL,CN,ACTIVE,2020-08-19T06:08:07Z
3003005A9U177L8GVS72,陕西电子信息集团有限公司,N/A,N/A,['陕西省西安市高新区锦业路125号'],CN,100000,['陕西省西安市高新区锦业路125号'],CN,100000,RA000092,91610000797924728K,GENERAL,CN,ACTIVE,2020-01-22T06:25:10Z
30030059XRT8E7IVFF30,贵阳中精科技有限公司,N/A,N/A,['贵州省贵阳市清镇市煤化工园（市卫城镇凤凰村凤凰组）'],CN,550000,['贵州省贵阳市清镇市煤化工园（市卫城镇凤凰村凤凰组）'],CN,550000,RA000092,91520181594175958Y,GENERAL,CN,ACTIVE,2020-07-21T06:06:34Z
3003005A2ZDO35TNGI68,柏乡融信村镇银行股份有限公司,N/A,N/A,['河北省柏乡县汉牡丹街364号（汉牡丹街与贸易路交口）'],CN,054000,['河北省柏乡县汉牡丹街364号（汉牡丹街与贸易路交口）'],CN,054000,RA000092,91130500MA0DWH9E1D,GENERAL,CN,ACTIVE,2019-12-24T00:54:11Z
30030059Y6EV8GY2Z978,山西岚县农村商业银行股份有限公司,N/A,N/A,['岚县县城向阳路西三街1号'],CN,100000,['岚县县城向阳路西三街1号'],CN,100000,RA000092,91141127112580871W,GENERAL,CN,ACTIVE,2019-04-18T05:32:04Z
3003005A3QL2RIPT3933,江西省水利投资集团（中国）有限公司,N/A,N/A,['香港观塘区九龙湾常悦道9号企业广场1期3座16楼07室'],HK,999077,['香港观塘区九龙湾常悦道9号企业广场1期3座16楼07室'],HK,999077,RA000389,70913479,GENERAL,HK,ACTIVE,2019-07-29T08:02:45Z
30030059X4D27BGP2C40,昌吉市华中小额贷款有限公司,N/A,N/A,['治区昌吉回族自治州新疆昌吉州昌吉市北京南路79号（58区1丘123栋）'],CN,100000,['治区昌吉回族自治州新疆昌吉州昌吉市北京南路79号（58区1丘123栋）'],CN,100000,RA000092,9165230109194425XD,GENERAL,CN,ACTIVE,2020-04-26T08:14:27Z
3003005A43KTJSP6Q919,宜昌富饶新材料科技有限公司,N/A,N/A,['长阳磨市镇芦溪村二组（岩屋冲）'],CN,430000,['长阳磨市镇芦溪村二组（岩屋冲）'],CN,430000,RA000092,91420528082340956H,GENERAL,CN,ACTIVE,2020-06-24T01:14:20Z
3003005AAULOIW90JA96,苏州捷研芯电子科技有限公司,N/A,N/A,['苏州工业园区东富路2号东景工业坊56幢'],CN,215000,['苏州工业园区东富路2号东景工业坊56幢'],CN,215000,RA000092,91320594339247846R,GENERAL,CN,ACTIVE,2020-08-17T05:37:28Z
3003005AF02ARPPYOF04,烟台千林贸易有限公司,N/A,N/A,['芝罘区西盛街28号18层3号'],CN,264000,['芝罘区西盛街28号18层3号'],CN,264000,RA000092,9137060274024529XY,GENERAL,CN,ACTIVE,2020-10-15T06:22:49Z
3003005AE09W6UKZK181,Cinda Sino-Rock Investment Limited,N/A,N/A,['克雷格缪尔楼'],VG,VG1110,['柯士甸道西1号环球贸易广场8206室'],HK,999077,RA000063,1818919,GENERAL,VG,ACTIVE,2018-02-23T07:15:53Z
3003005ARSAIA9EYW688,北京昌平科技园发展有限公司,N/A,N/A,['北京市昌平区科技园区超前路9号801室'],CN,100000,['北京市昌平区科技园区超前路9号801室'],CN,100000,RA000092,911101143442238738,GENERAL,CN,ACTIVE,2020-02-08T07:08:01Z
3003005AGZ4Q3NP0NK07,GOLD MANY GLOBAL LTD,N/A,N/A,['9 pantygraigwen road'],GB,CF372RR,['9 pantygraigwen road'],GB,CF372RR,RA000585,10181390,GENERAL,GB,INACTIVE,2018-02-08T16:00:00Z
3003005APPE9ZPAMY566,海国鑫泰资本有限公司,N/A,N/A,['珀塞尔港黑本道夸马尔贸易大厦8单元3层'],VG,VG1110,['西四环北路9号鑫泰大厦'],CN,100195,RA000063,1983977,GENERAL,VG,ACTIVE,2019-04-25T02:04:40Z
3003005ARWK3APDOL318,福建红星美凯龙置业有限公司,N/A,N/A,['福建省福州市仓山区金山街道浦上大道198号爱琴海购物公园六层601'],CN,100000,['福建省福州市仓山区金山街道浦上大道198号爱琴海购物公园六层601'],CN,100000,RA000092,91350000559591534W,GENERAL,CN,ACTIVE,2020-02-05T02:10:15Z
3003005AJX7K76KMB967,辽宁普瑞保险代理有限公司,N/A,N/A,['大石桥市钢都管理区长征街陶瓷里'],CN,100000,['大石桥市钢都管理区长征街陶瓷里'],CN,100000,RA000092,91210882785126825J,GENERAL,CN,ACTIVE,2020-04-24T05:28:12Z
3003005AXPDA6LFH6T93,大唐电信科技股份有限公司,N/A,N/A,['北京市海淀区永嘉北路6号5幢'],CN,100000,['北京市海淀区永嘉北路6号5幢'],CN,100000,RA000092,91110000633709976B,GENERAL,CN,ACTIVE,2020-03-26T15:03:37Z
3003005B7Q8Q456AAG59,Ocean Fund SPC,N/A,N/A,"['Walkers Corporate Limited,Cayman Corporate Centre,27 Hospital Road']",KY,KY1-9008,['旺角廣東道998號旺角協成行14樓14A2室'],HK,999077,RA000086,WC-349941,GENERAL,KY,ACTIVE,2020-06-09T16:00:00Z
3003005B6AW2GE7MXD67,爱璞特（上海）自动化液压机模具贸易有限公司,N/A,N/A,['区北张家浜路88号5幢B808室'],CN,100000,['区北张家浜路88号5幢B808室'],CN,100000,RA000092,91310000694231005E,GENERAL,CN,ACTIVE,2017-12-04T08:29:18Z
3003005B1P1DDWW0YZ95,响水富润建材有限公司,N/A,N/A,['响水县县城开山路西侧、银河路北侧富建3A#幢商业104-204'],CN,224600,['响水县县城开山路西侧、银河路北侧富建3A#幢商业104-204'],CN,224600,RA000092,91320921MA1WTKKH73,GENERAL,CN,ACTIVE,2020-08-24T06:12:42Z
3003005B5JJJ74VQUZ26,瑞元资本管理有限公司,N/A,N/A,['珠海市横琴新区宝华路6号105室-49849（集中办公区）'],CN,100000,['珠海市横琴新区宝华路6号105室-49849（集中办公区）'],CN,100000,RA000092,914404000718573787,GENERAL,CN,ACTIVE,2019-12-19T01:32:23Z
3003005AZPZZO0UQ2W91,上海品众商业保理有限公司,N/A,N/A,['区中国（上海）自由贸易试验区崮山路648号8幢419室'],CN,100000,['区中国（上海）自由贸易试验区崮山路648号8幢419室'],CN,100000,RA000092,91310000076436089G,GENERAL,CN,ACTIVE,2020-02-10T06:43:07Z
3003005B4FO58LM57L81,苏亚金诚会计师事务所（特殊普通合伙）,N/A,N/A,['江苏省南京市中山北路105-6号2201室'],CN,100000,['江苏省南京市中山北路105-6号2201室'],CN,100000,RA000092,91320000085046285W,GENERAL,CN,ACTIVE,2020-06-02T02:28:44Z
3003005B7IK42TI76173,锐联发展有限公司,N/A,N/A,"['Suite 23,1st Floor,Eden Plaza']",SC,999126,"['Suite 23,1st Floor,Eden Plaza']",SC,999126,RA000521,159751,GENERAL,SC,ACTIVE,2017-12-15T07:19:06Z
3003005B4GMKOJBFXY48,江苏南通发电有限公司,N/A,N/A,['南通市港闸区芦泾路1号'],CN,100000,['南通市港闸区芦泾路1号'],CN,100000,RA000092,9132060057815804XQ,GENERAL,CN,ACTIVE,2020-02-18T07:29:33Z
3003005AUP0TDPTNWT42,张家口通泰控股集团有限公司,N/A,N/A,['市张家口市桥西区明德北大街西山底小区3号楼'],CN,100000,['市张家口市桥西区明德北大街西山底小区3号楼'],CN,100000,RA000092,91130700661067042W,GENERAL,CN,ACTIVE,2020-03-16T07:23:17Z
3003005B8O1476H01K23,四川航空股份有限公司,N/A,N/A,['成都市双流国际机场航空大厦'],CN,100000,['成都市双流国际机场航空大厦'],CN,100000,RA000092,91510000742262413G,GENERAL,CN,ACTIVE,2020-03-19T13:58:46Z
3003005B8ZKCKWFWV179,苏州中新华智光源科技有限公司,N/A,N/A,['苏州工业园区星湖街218号A4楼505、506单元'],CN,215000,['苏州工业园区星湖街218号A4楼505、506单元'],CN,215000,RA000092,91320594MA1MFAKT2P,GENERAL,CN,ACTIVE,2020-08-12T00:32:36Z
3003005BAC4MTEQB8X51,汉中市汉台区农村信用合作联社,N/A,N/A,['汉台区民主街1号'],CN,100000,['汉台区民主街1号'],CN,100000,RA000092,916107022225863857,GENERAL,CN,ACTIVE,2019-04-04T06:03:44Z
3003005BDWX5UPZUZH31,苏州微格纳米科技有限公司,N/A,N/A,['江苏省苏州市工业园区胜浦江浦路46号'],CN,215000,['江苏省苏州市工业园区胜浦江浦路46号'],CN,215000,RA000092,91320594314023264Y,GENERAL,CN,ACTIVE,2020-04-17T07:16:20Z
3003005BBLF71O8CKP44,华泰紫金投资有限责任公司,N/A,N/A,['南京市汉中路180号'],CN,100000,['南京市汉中路180号'],CN,100000,RA000092,913200006798204772,GENERAL,CN,ACTIVE,2020-03-12T05:24:37Z
3003005BM510202P2G76,扬子石化—巴斯夫有限责任公司,N/A,N/A,['六合区乙烯路266号'],CN,210048,['六合区新华东路8号'],CN,210048,RA000092,91320000710939573X,GENERAL,CN,ACTIVE,2017-12-13T07:15:48Z
3003005BFTPK35L27I88,PANORAMA MASTER FUND,N/A,N/A,"['Ugland House', 'P.O. Box 309', 'Grand Cayman']",KY,KY1-1104,"['c/o R Squared Limited', 'Room D', '10/F Tower A', 'Billion Centre 1 Wang Kwong Rd, Kowloon Bay']",HK,999077,RA000087,1807816,FUND,KY,ACTIVE,2020-05-25T02:39:44Z
3003005BNAHUKT6ET984,海城市金财土地房屋投资有限公司,N/A,N/A,['辽宁省鞍山市海城市中街北路18号（北关街利群委）'],CN,100000,['辽宁省鞍山市海城市中街北路18号（北关街利群委）'],CN,100000,RA000092,91210381692656309G,GENERAL,CN,ACTIVE,2020-02-22T07:57:34Z
3003005BM6I66SA0W843,福建一卡通网络有限责任公司,N/A,N/A,['晋安区岳峰镇连江北路与化工路交叉处东二环泰禾城市广场（三期）22#楼七层06商业'],CN,100000,['晋安区岳峰镇连江北路与化工路交叉处东二环泰禾城市广场（三期）22#楼七层06商业'],CN,100000,RA000092,9135058255759853X3,GENERAL,CN,ACTIVE,2019-03-21T01:11:50Z
3003005BI6W24POQHC92,南通百适乐运动科技集团有限公司,N/A,N/A,['城北街道惠民西路8号'],CN,226500,['城北街道惠民西路8号'],CN,226500,RA000092,913206827974449276,GENERAL,CN,ACTIVE,2019-07-30T00:15:38Z
3003005BECBGX8E9G051,大鹏证券有限责任公司,N/A,N/A,['深圳市罗湖区深南东路5002号信兴广场地王商业中心商业大楼八层'],CN,100000,['深圳市罗湖区深南东路5002号信兴广场地王商业中心商业大楼八层'],CN,100000,RA000092,914403001923983317,GENERAL,CN,ACTIVE,2020-05-11T06:45:36Z
3003005BFY5USC5SFW89,无锡聚协机械有限公司,N/A,N/A,['新吴区硕放街道裕安路88号'],CN,214000,['新吴区硕放街道裕安路88号'],CN,214000,RA000092,91320214323866044B,GENERAL,CN,ACTIVE,2020-10-15T00:49:00Z
3003005BGYJ4JLV6RQ34,DomizilPlus,N/A,N/A,['Steinhauserstrasse 74'],CH,6300,['Steinhauserstrasse 74'],CH,6300,RA000548,CHE426134992,GENERAL,CH,ACTIVE,2017-05-25T00:00:00Z
3003005BIKOG924DCM66,朔州市投资建设开发有限公司,N/A,N/A,['朔州市民福东街2号'],CN,100000,['朔州市民福东街2号'],CN,100000,RA000092,911406007540988763,GENERAL,CN,ACTIVE,2020-05-15T04:12:25Z
3003005BGLWV65A52E28,九江市置地投资有限公司,N/A,N/A,['江西省九江市九江经济技术开发区八里湖环湖二路怡景苑2栋'],CN,100000,['江西省九江市九江经济技术开发区八里湖环湖二路怡景苑2栋'],CN,100000,RA000092,91360406561069841B,GENERAL,CN,ACTIVE,2020-02-22T08:05:19Z
3003005BQ23X4W55EY13,Industrial Investment Overseas Limited,N/A,N/A,['邮政信箱3170，威克汉姆2号礁，里特住宅'],VG,VG1110,['天浦路1号'],CN,210000,RA000063,2012793,GENERAL,VG,ACTIVE,2019-05-14T06:23:29Z
3003005BNDQJQUF3AF64,基伊埃韦斯伐里亚分离机（中国）有限公司,N/A,N/A,['新界葵涌葵丰街53-57号福业大厦8楼805-806室'],HK,999077,['新界葵涌葵丰街53-57号福业大厦8楼805-806室'],HK,999077,RA000389,1151877500012160,GENERAL,HK,INACTIVE,2018-01-18T16:00:00Z
3003005BNZPWGG5UNL57,重庆城口中银富登村镇银行有限公司,N/A,N/A,['葛城街道北大街34号'],CN,100000,['葛城街道北大街34号'],CN,100000,RA000092,91500000321644245U,GENERAL,CN,ACTIVE,2019-04-03T07:24:03Z
3003005BPKQW8OVH9H68,扬州经济技术开发区开发(集团)有限公司,N/A,N/A,['扬州市维扬路108号'],CN,225000,['扬州市维扬路108号'],CN,225000,RA000092,91321091140721264G,GENERAL,CN,ACTIVE,2019-03-27T07:02:10Z
3003005BXY5VHW41BT48,TCL商业保理（深圳）有限公司,N/A,N/A,['深圳市前海深港合作区前湾一路1号A栋201室（入驻深圳市前海商务秘书有限公司）'],CN,100000,['深圳市前海深港合作区前湾一路1号A栋201室（入驻深圳市前海商务秘书有限公司）'],CN,100000,RA000092,91440300342511951C,GENERAL,CN,ACTIVE,2019-12-02T01:02:20Z
