LEI,Legal Name,Parent LEI,Parent Name,Legal Address,Legal City,Legal Postal Code,HQ Address,HQ City,HQ Postal Code,Registration ID,Registered As,Category,Legal Jurisdiction,Entity Status,Registration Date
335800AK2KUSE1YPLZ16,HONEYCOMB SOFTWARES PRIVATE LIMITED,N/A,N/A,"['A-404, THE LANDMARK', 'OPP. KANSAR RESTAURANT', 'KUDASAN']",IN,382421,"['A-404, THE LANDMARK', 'OPP. KANSAR RESTAURANT', 'KUDASAN']",IN,382421,RA000394,U72900GJ2012PTC071957,GENERAL,IN,ACTIVE,2018-09-18T11:41:00Z
335800AK1KB8CZM8DU87,TRUE WALL SPECIALITIES PRIVATE LIMITED,N/A,N/A,"['182/1, RETIWALA COMPOUND, CADELL ROAD, MAHIM (WEST)']",IN,400016,"['182/1, RETIWALA COMPOUND, CADELL ROAD, MAHIM (WEST)']",IN,400016,RA000394,U36990MH2007PTC170792,GENERAL,IN,ACTIVE,2023-06-20T11:13:29Z
335800AJZZ5WCY1EUD73,ADANI FINSERVE PRIVATE LIMITED,N/A,N/A,"['ADANI HOUSE, NEAR MITHAKHALI SIX ROADS', 'NAVRANGPURA AHMEDABAD']",IN,380009,"['ADANI HOUSE, NEAR MITHAKHALI SIX ROADS', 'NAVRANGPURA AHMEDABAD']",IN,380009,RA000394,U65993GJ2016PTC086524,GENERAL,IN,ACTIVE,2022-11-17T10:53:48Z
335800AK1DBBMJP8TK21,TEXKNIT PROCESSORS PRIVATE LIMITED,N/A,N/A,['HB-23 PHASE VI FOCAL POINT'],IN,141010,['HB-23 PHASE VI FOCAL POINT'],IN,141010,RA000394,U17299PB2021PTC052740,GENERAL,IN,ACTIVE,2023-05-11T10:34:20Z
335800AK323UC9WWMP63,SHREE BALAJI GROUP,N/A,N/A,"['4TH FLOOR, SHOP NO. 404', 'TIRUPATI SQUARE', 'NEAR PTM MARKET', 'SAHARA DARWAJA']",IN,395002,"['4TH FLOOR, SHOP NO. 404', 'TIRUPATI SQUARE', 'NEAR PTM MARKET', 'SAHARA DARWAJA']",IN,395002,RA000754,24AEPFS6108G1ZW,GENERAL,IN,ACTIVE,2024-08-31T11:15:24Z
335800AK293YCGHZ7L23,BEHARI LAL BUDH RAM,N/A,N/A,"['B-6, MANDI YARD', 'NEWAI']",IN,304021,"['B-6, MANDI YARD', 'NEWAI']",IN,304021,RA000754,08AACFB5784A1ZO,GENERAL,IN,ACTIVE,2024-08-31T10:00:26Z
335800AK15EAC5OXXU05,VELMURUGAN POULTRY FARM,N/A,N/A,"['99-A/4,POTHIYAN THOTTAM,PALAKARAI']",IN,638057,"['99-A/4,POTHIYAN THOTTAM,PALAKARAI']",IN,638057,RA000754,33ANDPD5347D2ZI,SOLE_PROPRIETOR,IN,ACTIVE,2024-01-05T12:05:43Z
335800AK2NCLCLDD9D55,LOKESH MACHINES LTD,N/A,N/A,"['B-29, EEIE, STAGE-2', 'BALANAGAR,']",IN,500037,"['B-29, EEIE, STAGE-2', 'BALANAGAR,']",IN,500037,RA000394,L29219TG1983PLC004319,GENERAL,IN,ACTIVE,2018-12-03T12:19:49Z
335800AJZ7NO4XG4AB67,ASHISH INTERBUILD PRIVATE LIMITED,N/A,N/A,"['204 A.R.K. INDUSTRIAL ESTATE,', 'ANDHERI EAST MUMBAI', 'MAKAWANA ROAD MAROL NAKA']",IN,400059,"['204 A.R.K. INDUSTRIAL ESTATE,', 'ANDHERI EAST MUMBAI', 'MAKAWANA ROAD MAROL NAKA']",IN,400059,RA000394,U45202MH2008PTC185637,GENERAL,IN,ACTIVE,2022-07-21T11:39:32Z
335800AK3HENKUIFWU03,SOLANKI BROS. MATIALA,N/A,N/A,"['96//10, MUBARIKPUR ROAD', 'FARRUKHNAGAR']",IN,122506,"['96//10, MUBARIKPUR ROAD', 'FARRUKHNAGAR']",IN,122506,RA000754,06BHJPS6306Q1ZN,SOLE_PROPRIETOR,IN,ACTIVE,2024-03-28T07:12:04Z
335800AK5F42TJCDGN80,DEEPLOK FINANCIAL SERVICES LTD,N/A,N/A,"['11/1, SARAT BOSE ROAD, SOUTH BLOCK, 2ND FLOOR,, KOLKATA, WEST BENGAL, INDIA,']",IN,700020,"['11/1, SARAT BOSE ROAD, SOUTH BLOCK, 2ND FLOOR,, KOLKATA, WEST BENGAL, INDIA,']",IN,700020,RA000394,L17115WB1981PLC033469,GENERAL,IN,ACTIVE,2021-08-31T09:10:00Z
335800AK44JFUAHQKT77,HCL CORPORATION PRIVATE LIMITED,N/A,N/A,"['806, SIDDHARTHA, 96, NEHRU PLACE', 'NEW DELHI']",IN,110019,"['806, SIDDHARTHA, 96, NEHRU PLACE', 'NEW DELHI']",IN,110019,RA000394,U74120DL2008PTC183849,GENERAL,IN,ACTIVE,2019-05-03T12:51:10Z
335800AK2TTDQTMSDZ69,KONICA MINOLTA HEALTHCARE INDIA PRIVATE LIMITED,549300SVK6KRUOL1A740,コニカミノルタ株式会社,"['OFFICE NO. 201, 2ND FLOOR,', 'ATRIUM CENTRE - 2,', 'ANDHERI-KURLA ROAD, CHAKALA,', 'ANDHERI (EAST)']",IN,400093,"['OFFICE NO. 201, 2ND FLOOR,', 'ATRIUM CENTRE - 2,', 'ANDHERI-KURLA ROAD, CHAKALA,', 'ANDHERI (EAST)']",IN,400093,RA000394,U33110MH2010PTC200438,GENERAL,IN,ACTIVE,2020-03-16T14:00:16Z
335800AK6IKF5FX2HO40,SATHYAM PLY AND BOARDS,N/A,N/A,"['KP-V/270-C, M/S. SATHYAM PLY AND BOARDS, PANIPRA.P.O,KOTHAMANGALAM']",IN,686692,"['KP-V/270-C, M/S. SATHYAM PLY AND BOARDS, PANIPRA.P.O,KOTHAMANGALAM']",IN,686692,RA000754,32ABJFS5362H1Z3,GENERAL,IN,ACTIVE,2023-12-28T12:00:43Z
335800AK5JAKC3211Z89,AARUNYA CONSTRUCTION & SUPPLY SERVICES PRIVATE LIMITED,N/A,N/A,"['ZILA PARISHAD MARKET', 'RAJGIR']",IN,803116,"['ZILA PARISHAD MARKET', 'RAJGIR']",IN,803116,RA000394,U45309BR2017PTC034606,GENERAL,IN,ACTIVE,2024-08-05T05:51:21Z
335800AK8GR47PKWA424,VL SAVLI DEVELOPERS LLP,N/A,N/A,"['SHOP NO. 2, C WING,', 'BUILDING NO.150 NR. SHIVSENA SHAKHA,', 'KANNAMWAR NAGAR, VIKHROLI (E)']",IN,400083,"['SHOP NO. 2, C WING,', 'BUILDING NO.150 NR. SHIVSENA SHAKHA,', 'KANNAMWAR NAGAR, VIKHROLI (E)']",IN,400083,RA000394,AAO-5210,GENERAL,IN,ACTIVE,2023-07-26T06:47:05Z
335800AK8OHJ9DFQR710,KISCO TRADING INDIA PRIVATE LIMITED,N/A,N/A,"['OFFICE NO.607 06TH FLOOR,TIME TOWER,M G ROAD GURUGRAM']",IN,122002,"['OFFICE NO.607 06TH FLOOR,TIME TOWER,M G ROAD GURUGRAM']",IN,122002,RA000394,U51909HR2012FTC045231,GENERAL,IN,ACTIVE,2018-04-12T12:15:23Z
335800AK9ZXMG1YLOL74,BARODA BNP PARIBAS LARGE CAP FUND,N/A,N/A,"['BARODA BNP PARIBAS MUTUAL FUND,BNP PARIBAS HOUSE', '1 NORTH AVENUE, MAKER MAXITY,', 'BANDRA KURLA COMPLEX, BANDRA-EAST,']",IN,400051,"['C/O BARODA BNP PARIBAS ASSET MANAGEMENT INDIA PRIVATE LIMITED', 'BARODA BNP PARIBAS MUTUAL FUND,BNP PARIBAS HOUSE', '1 NORTH AVENUE, MAKER MAXITY,', 'BANDRA KURLA COMPLEX, BANDRA-EAST,']",IN,400051,RA000697,INF251K01HN7,FUND,IN,ACTIVE,2018-03-27T11:56:57Z
335800AK8XCQXSZ25V84,ASHTEKAR JEWELLERS,N/A,N/A,"['GROUND, 596, ASHTEKAR JEWELLERS, LAXMI ROAD, SADASHIV PETH']",IN,411030,"['GROUND, 596, ASHTEKAR JEWELLERS, LAXMI ROAD, SADASHIV PETH']",IN,411030,RA000754,27AACFA0860G1ZU,GENERAL,IN,ACTIVE,2023-08-25T09:52:58Z
335800AK6JADJMA6A980,KING-STON GARDENS,N/A,N/A,"['H.NO.130', 'BHULLAR AVENUE', 'FATEHGARH CHURIAN ROAD']",IN,143001,"['H.NO.130', 'BHULLAR AVENUE', 'FATEHGARH CHURIAN ROAD']",IN,143001,RA000900,UDYAM-PB-01-0090751,GENERAL,IN,ACTIVE,2024-10-17T08:42:43Z
335800AK9UEZFRVTKE95,K S P AGENCIES,N/A,N/A,"['119/76-142', 'FIRST FLOOR', 'DARSHANPURWA']",IN,208012,"['119/76-142', 'FIRST FLOOR', 'DARSHANPURWA']",IN,208012,RA000754,09ABBFK5364R1ZL,GENERAL,IN,ACTIVE,2024-12-03T04:57:20Z
335800AK9NWI8EKB4E59,ECONOMY PROCESS SOLUTIONS PRIVATE LIMITED,N/A,N/A,"['PLOT CTS NO.96, OFFICE UNIT 1401', '14TH FLOOR VIKAS CENTRE', 'CHEMBUR']",IN,400074,"['PLOT CTS NO.96, OFFICE UNIT 1401', '14TH FLOOR VIKAS CENTRE', 'CHEMBUR']",IN,400074,RA000394,U74999MH2015PTC263963,GENERAL,IN,ACTIVE,2023-12-02T09:32:12Z
335800AK6Q288VISZ788,S S MACHINERIES,N/A,N/A,"['PLOT NO 54 MELDI ESTATE,', 'NR GOTA RAILWAY CROSSING', 'GOTA']",IN,382481,"['PLOT NO 54 MELDI ESTATE,', 'NR GOTA RAILWAY CROSSING', 'GOTA']",IN,382481,RA000709,0813021898,GENERAL,IN,ACTIVE,2018-06-01T12:50:47Z
335800AK8BESGOUXBK35,SREE KRISHNA POWER ENGINEERING AND CONSULTANCY PRIVATE LIMITED,N/A,N/A,"['NO. 28, GANDHI NAGAR MAIN ROAD', 'MADAMBAKKAM, RAJAKILPAKKAM,', 'TAMBARAM']",IN,600073,"['NO. 28, GANDHI NAGAR MAIN ROAD', 'MADAMBAKKAM, RAJAKILPAKKAM,', 'TAMBARAM']",IN,600073,RA000394,U45204TN2009PTC070369,GENERAL,IN,ACTIVE,2024-10-19T12:08:37Z
335800AKBIN111ZDRH16,A K PANELS,N/A,N/A,"['1-312C, KAMBALA PADAV VIA KONAJE,', 'PAJEER,', 'KURNAD', 'DAKSHIN KANNAD']",IN,574153,"['1-312C, KAMBALA PADAV VIA KONAJE,', 'PAJEER,', 'KURNAD', 'DAKSHIN KANNAD']",IN,574153,RA000709,0791006301,GENERAL,IN,ACTIVE,2019-04-26T11:25:51Z
335800AK91Y7IYQPVB72,WATSUN INFRABUILD PRIVATE LIMITED,3358004RA32K53YGBC38,CONTINUUM GREEN ENERGY LIMITED,"['OFFICE NO.4, FIRST FLOOR', 'CITY CENTRE, OPPOSITE MANDAVI', 'OCTROI, COMMERCE COLLEGE ROAD,', 'BHUJ, KACHCHH']",IN,370001,"[""402 & 404, DELPHI 'C' WING"", 'HIRANANDANI BUSINESS PARK', 'ORCHARD AVENUE, POWAI', 'MUMBAI']",IN,400076,RA000394,U45400GJ2010PTC060918,GENERAL,IN,ACTIVE,2018-10-20T12:39:00Z
335800AKBK662ISUDX44,YUTAKA AUTOPARTS INDIA PRIVATE LIMITED,N/A,N/A,"['1005, ROOTS TOWER,', 'PLOT NO.7 DISTRICT CENTER,', 'NEAR NIRMAN VIHAR METRO STATION', 'LAXMINAGAR EAST DELHI']",IN,110092,"['1005, ROOTS TOWER,', 'PLOT NO.7 DISTRICT CENTER,', 'NEAR NIRMAN VIHAR METRO STATION', 'LAXMINAGAR EAST DELHI']",IN,110092,RA000394,U35923DL2007FTC160180,GENERAL,IN,ACTIVE,2020-09-10T10:03:00Z
335800AKBY98LZIAYT45,MSK CONSULTANTS AND ENGINEERS PVT LTD,N/A,N/A,"['PLOT NO.186/B', 'FLAT NO.A-1', 'SRI TIRUMALA MENSION', 'S.R. NAGAR']",IN,500038,"['PLOT NO.186/B', 'FLAT NO.A-1', 'SRI TIRUMALA MENSION', 'S.R. NAGAR']",IN,500038,RA000394,U74999TG2012PTC079718,GENERAL,IN,ACTIVE,2019-07-18T13:58:52Z
335800AKADM25QA9OC62,BANSAL ISPAT UDYOG,N/A,N/A,"['GT ROAD', 'SIRHIND SIDE', 'FATEHGARH SAHIB']",IN,147301,"['GT ROAD', 'SIRHIND SIDE', 'FATEHGARH SAHIB']",IN,147301,RA000754,03AABFB4634Q1ZF,GENERAL,IN,ACTIVE,2021-09-18T07:44:34Z
335800AKBLSMB2CPCO98,NISSAN MOTOR INDIA PRIVATE LIMITED,353800DRBDH1LUTNAY26,日産自動車株式会社,"['PLOT NO.1A', 'SIPCOT INDUSTRIAL AREA', 'ORGADAM,MATTUR POST', 'SRIPERUMPUDUR']",IN,602105,"['PLOT NO.1A', 'SIPCOT INDUSTRIAL AREA', 'ORGADAM,MATTUR POST', 'SRIPERUMPUDUR']",IN,602105,RA000394,U34100TN2005PTC073897,GENERAL,IN,ACTIVE,2018-01-15T13:27:04Z
335800AKC2Y6ZRIZ7R50,MARVEL PROPERTIES PRIVATE LIMITED,N/A,N/A,"['NO. 6/12,', 'PRIMROSE ROAD,']",IN,560025,"['NO. 6/12,', 'PRIMROSE ROAD,']",IN,560025,RA000394,U45200KA2008PTC132756,GENERAL,IN,ACTIVE,2024-04-23T12:31:20Z
335800AKEDYVUQ2YCD53,DARSHANAM INFRACON,N/A,N/A,"['DARSHANAM SPINAL STONE,', 'B/H ISCON HEIGHTS GOTRI ROAD', 'GOTRI']",IN,390021,"['DARSHANAM SPINAL STONE,', 'B/H ISCON HEIGHTS GOTRI ROAD', 'GOTRI']",IN,390021,RA000754,24AASFD4105B1ZX,GENERAL,IN,ACTIVE,2023-03-03T12:33:22Z
335800AKDOKM1DGICU11,TEEMAGE BUILDERS PRIVATE LIMITED,N/A,N/A,"['6/35, COLLEGE ROAD, 1ST CROSS STREET,']",IN,641602,"['6/35, COLLEGE ROAD, 1ST CROSS STREET,']",IN,641602,RA000394,U45202TZ2007PTC014038,GENERAL,IN,ACTIVE,2019-04-15T11:15:18Z
335800AKE8PEPVPERF25,GARG OILS,N/A,N/A,"['VILLAGE BAILARA, TEHSIL NADBAI, NADBAI,']",IN,321602,"['VILLAGE BAILARA, TEHSIL NADBAI, NADBAI,']",IN,321602,RA000754,08AAOFG1207B1ZV,GENERAL,IN,ACTIVE,2022-01-18T08:11:48Z
335800AKCDCAUDNRZY44,MINDPOWER FINSOURCE SERVICES PRIVATE LIMITED,N/A,N/A,"['B-302, ATMA HOUSE, OPP. OLD R.B.I.', 'NR. TIMES OF INDIA', 'ASHRAM ROAD']",IN,380009,"['B-302, ATMA HOUSE, OPP. OLD R.B.I.', 'NR. TIMES OF INDIA', 'ASHRAM ROAD']",IN,380009,RA000394,U93000GJ2007PTC051284,GENERAL,IN,ACTIVE,2024-01-11T07:16:45Z
335800AKDC7T933T3I86,HINDUSTAN AERONAUTICS LIMITED,N/A,N/A,"['15/1, CUBBON ROAD, POST BOX NO.5150']",IN,560001,"['15/1, CUBBON ROAD, POST BOX NO.5150']",IN,560001,RA000394,L35301KA1963GOI001622,GENERAL,IN,ACTIVE,2019-01-14T11:50:57Z
335800AKCJ4ZFQLX1E29,DR. RAM MANOHAR LOHIA INSTITUTE OF MEDICAL SCIENCES,N/A,N/A,"['VIBHUTI KHAND', 'GOMTI NAGAR']",IN,226010,"['VIBHUTI KHAND', 'GOMTI NAGAR']",IN,226010,RA000754,09AAAJD1459L2Z1,GENERAL,IN,ACTIVE,2024-07-03T06:50:12Z
335800AKC2PGFS9NLD47,SEARS IT & MANAGEMENT SERVICES INDIA PRIVATE LIMITED,N/A,N/A,"['4th Floor Wing 2 Cluster D, EON Free ZoneKharadi Phase I, Pune, Pune, Maharashtra, India,']",IN,411014,"['4th Floor Wing 2 Cluster D, EON Free ZoneKharadi Phase I, Pune, Pune, Maharashtra, India,']",IN,411014,RA000394,U74900PN2009FTC134832,GENERAL,IN,ACTIVE,2020-03-30T13:08:52Z
335800AKDGA8RAJDTV30,S. S. INDUSTRIES,N/A,N/A,"['E - 63, M.I.D.C AREA']",IN,425003,"['E - 63, M.I.D.C AREA']",IN,425003,RA999999,,GENERAL,IN,ACTIVE,2022-06-20T09:27:20Z
335800AKDEAPQDV9RL83,360 ONE EQUITY OPPORTUNITY FUND SERIES 2,N/A,N/A,"['IIFL CENTRE', 'KAMALA CITY', 'SENAPATI BAPAT MARG', 'LOWER PAREL']",IN,400013,"['C/O 360 ONE ASSET MANAGEMENT LIMITED IIFL CENTRE', 'KAMALA CITY', 'SENAPATI BAPAT MARG', 'LOWER PAREL']",IN,400013,RA000395,IN/AIF3/12-13/0016,FUND,IN,ACTIVE,2022-12-23T05:31:08Z
335800AKEMBUSL7S8N22,LALLY AUTOMOBILES (INDIA) PRIVATE LIMITED,N/A,N/A,"['PLOT NO 6', 'INDUSTRIAL AREA PHASE 1']",IN,160002,"['PLOT NO 6', 'INDUSTRIAL AREA PHASE 1']",IN,160002,RA000394,U70109CH2010PTC032537,GENERAL,IN,ACTIVE,2023-05-03T11:45:08Z
335800AKF2P5ROJXKQ56,ACTIVE ENTERPRISES,N/A,N/A,"['PLOT NO.6', 'JAI HIND SOCIETY', 'SHYAM NAGAR']",IN,440037,"['PLOT NO.6', 'JAI HIND SOCIETY', 'SHYAM NAGAR']",IN,440037,RA000754,27AAPFA1567K1Z2,GENERAL,IN,ACTIVE,2022-03-05T08:11:57Z
335800AKFFMMUBMNJ194,E V HOMES CONSTRUCTIONS PRIVATE LIMITED,N/A,N/A,"['OFFICE NO 212 VARDHAMAN CHAMBERS', 'A WING PLOT NO 84 SECTOR 17', 'VASHI']",IN,400703,"['OFFICE NO 212 VARDHAMAN CHAMBERS', 'A WING PLOT NO 84 SECTOR 17', 'VASHI']",IN,400703,RA000394,U45200MH2005PTC155637,GENERAL,IN,ACTIVE,2023-03-20T12:06:24Z
335800AKFL1QNYSI8J45,SHRI RAMAN BIHARI AGRO INDUSTRIES PRIVATE LIMITED,N/A,N/A,"['135 N BLOCK', 'KIDWAI NAGAR']",IN,208011,"['135 N BLOCK', 'KIDWAI NAGAR']",IN,208011,RA000394,U15311UP2004PTC028485,GENERAL,IN,ACTIVE,2023-03-06T12:33:06Z
335800AKEJO41PDJYN32,KK LIGHTING INDIA PRIVATE LIMITED,N/A,N/A,"['PLOT NO. 88,89 & 71, SECTOR-53, PHASE-V, HSIIDC INDUSTRIAL ESTATE KUNDLI,']",IN,131028,"['PLOT NO. 88,89 & 71, SECTOR-53, PHASE-V, HSIIDC INDUSTRIAL ESTATE KUNDLI,']",IN,131028,RA000394,U74999HR2018PTC074954,GENERAL,IN,ACTIVE,2024-01-31T10:55:50Z
335800AKH2CUCY6Q9663,SHRE RICE PROWIN PRIVATE LIMITED,N/A,N/A,"['33/A2, KARUPPANNAN STREET, R.P.PUDUR']",IN,637001,"['33/A2, KARUPPANNAN STREET, R.P.PUDUR']",IN,637001,RA000394,U15490TZ2020PTC033694,GENERAL,IN,ACTIVE,2022-01-13T12:47:32Z
335800AKJ6OPVG1IIG20,BARANI SILKS PRIVATE LIMITED,N/A,N/A,"['D.NO.155', 'SHENBAGAVINAYAGAR KOIL STREET']",IN,627811,"['D.NO.155', 'SHENBAGAVINAYAGAR KOIL STREET']",IN,627811,RA000394,U18109TN2020PTC135141,GENERAL,IN,ACTIVE,2022-11-24T11:18:23Z
335800AKH1SY5ERW1R26,MASKARA VINIMAY PVT LTD,N/A,N/A,"['Ranisati Weigh Bridge', 'Mithapur, Uttar Dinajpur']",IN,733201,"['Ranisati Weigh Bridge', 'Mithapur, Uttar Dinajpur']",IN,733201,RA000394,U51109WB2005PTC106952,GENERAL,IN,ACTIVE,2018-11-01T18:28:50Z
335800AKK9FAISHSS109,PENINSULA SMART GRID SOLUTIONS PRIVATE LIMITED,N/A,N/A,"['16TH FLOOR, BUILDING NO 5', 'BLOCK C, DLF CYBER CITY', 'DLF QE']",IN,122002,"['16TH FLOOR, BUILDING NO 5', 'BLOCK C, DLF CYBER CITY', 'DLF QE']",IN,122002,RA000394,U27900HR2024PTC118171,GENERAL,IN,ACTIVE,2024-08-31T13:29:18Z
335800AKKI2DPVILKC37,ERGODE TRADING PRIVATE LIMITED,N/A,N/A,"['44,JAMNADAS INDUSTRIAL ESTATE,OPP. JAWAHAR TALKIES DR. R.P. ROAD, MULUND WEST']",IN,400080,"['44,JAMNADAS INDUSTRIAL ESTATE,OPP. JAWAHAR TALKIES DR. R.P. ROAD, MULUND WEST']",IN,400080,RA000394,U52100MH2016PTC274816,GENERAL,IN,ACTIVE,2022-10-27T10:07:34Z
335800AKK93YSJB1QZ58,IQ CITY FOUNDATION,N/A,N/A,"['BIZRA ROAD, SOVAPUR, BARDHAMAN']",IN,713205,"['BIZRA ROAD, SOVAPUR, BARDHAMAN']",IN,713205,RA000754,19AAAAI8207J1ZJ,GENERAL,IN,ACTIVE,2019-07-10T11:17:41Z
335800AKKNJHFHBA5553,UTI MEDIUM DURATION FUND,N/A,N/A,"['UTI TOWER', 'BANDRA KURLA COMPLEX', 'GN BLOCK', 'BANDRA (EAST)']",IN,400051,"['C/O UTI ASSET MANAGEMENT COMPANY LIMITED UTI TOWER', 'BANDRA KURLA COMPLEX', 'GN BLOCK', 'BANDRA (EAST)']",IN,400051,RA000697,INF789FB1JU4,FUND,IN,ACTIVE,2018-11-01T12:15:35Z
335800AKJG5LN2AJDO19,AAPNA INFOTHEEK PRIVATE LIMITED,N/A,N/A,"['57, CHARAK SADAN', 'VIKAS PURI']",IN,110018,"['57, CHARAK SADAN', 'VIKAS PURI']",IN,110018,RA000394,U72300DL2007PTC171709,GENERAL,IN,ACTIVE,2018-06-29T13:06:30Z
335800AKHRBCTKM61U09,CANADIAN SOLAR INDIA PRIVATE LIMITED,N/A,N/A,"['E-5 GROUND FLOOR', 'DEFENCE COLONY']",IN,110024,"['E-5 GROUND FLOOR', 'DEFENCE COLONY']",IN,110024,RA000394,U74999DL2016FTC308668,GENERAL,IN,INACTIVE,2019-07-08T13:44:10Z
335800AKJZFUB4ACD756,INDIAN TEXTILE CLOTHINGS,N/A,N/A,"['46/33,', 'KUMARAPPAPURAM 1ST STREET,', 'RAYAPURAM EXTENSION,']",IN,641601,"['NO.449', 'MANGALAM ROAD,', 'JALLIMEDU THOTTAM', 'AANDIPALAYAM']",IN,641687,RA000754,33AAGFI1797Q1ZQ,GENERAL,IN,ACTIVE,2022-05-06T11:01:02Z
335800AKL4725RB1FC35,CRIMSONCOVE DEVELOPERS PRIVATE LIMITED,N/A,N/A,"['FIRST FLOOR, EMBASSYPOINT NO150 INFANTRY ROAD,']",IN,560001,"['FIRST FLOOR, EMBASSYPOINT NO150 INFANTRY ROAD,']",IN,560001,RA000394,U68100KA2024PTC186291,GENERAL,IN,ACTIVE,2024-08-06T06:30:46Z
335800AKM64SJF8EQN73,ASSOCIATED LIGHTING COMPANY,N/A,N/A,"['PLOT NO. 101 & 102,', 'NOIDA SPECIAL ECONOMIC ZONE,', 'GAUTAM BUDH NAGAR,']",IN,201305,"['17, COMMUNITY CENTRE,', 'NEW FRIENDS COLONY,']",IN,110065,RA000709,4105003810,GENERAL,IN,ACTIVE,2020-09-01T15:25:27Z
335800AKNI23HT4P2C64,GOA CARBON LIMITED,N/A,N/A,"['DEMPO HOUSE', 'CAMPAL PANAJI']",IN,403001,"['DEMPO HOUSE', 'CAMPAL PANAJI']",IN,403001,RA000394,L23109GA1967PLC000076,GENERAL,IN,ACTIVE,2018-11-14T10:39:04Z
335800AKNFMDNPUNFR19,MAHADEV FERRO CAST PRIVATE LIMITED,N/A,N/A,"['SURVEY NO. 265/P2,3,4, KOTHARIA SOLVENT,', 'OPP. PARIN FURNITURE, GONDAL ROAD,']",IN,360002,"['SURVEY NO. 265/P2,3,4, KOTHARIA SOLVENT,', 'OPP. PARIN FURNITURE, GONDAL ROAD,']",IN,360002,RA000394,U27205GJ2019PTC110385,GENERAL,IN,ACTIVE,2020-05-19T10:57:05Z
335800AKN19E4CF2FP54,UNIDUS DECOR PRIVATE LIMITED,N/A,N/A,"['1/101-B, W.H.S. TIMBER MARKET', 'KIRTI NAGAR, NEW DELHI']",IN,110015,"['1/101-B, W.H.S. TIMBER MARKET', 'KIRTI NAGAR, NEW DELHI']",IN,110015,RA000394,U74899DL1980PTC010782,GENERAL,IN,ACTIVE,2024-09-16T12:20:56Z
335800AKW48ZMXHGDR33,YARLAGADDA EXPORTS PRIVATE LIMITED,N/A,N/A,"['26-5-16, TOBACCO HOUSE,OPP.', 'STALLS JUNIOR COLLEGE MAIN ROAD', 'NAGARAMPALEM,']",IN,522004,"['26-5-16, TOBACCO HOUSE,OPP.', 'STALLS JUNIOR COLLEGE MAIN ROAD', 'NAGARAMPALEM,']",IN,522004,RA000394,U15312AP1990PTC011885,GENERAL,IN,ACTIVE,2024-02-03T10:13:44Z
335800AKUPC3XB8CKF76,RANI AQUA FEEDS PRIVATE LIMITED,N/A,N/A,"['# 3-106/5, KURUMADDALI, PAMARRU MANDAL, ANDHRA PRADESH -']",IN,521157,"['# 3-106/5, KURUMADDALI, PAMARRU MANDAL, ANDHRA PRADESH -']",IN,521157,RA000394,U15312AP2006PTC049991,GENERAL,IN,ACTIVE,2024-03-18T12:27:34Z
335800AKOZJPWPCDU312,GUERIR PHARMACEUTICALS PRIVATE LIMITED,N/A,N/A,"['D-246, OFFICE NO 301-302, 3RD FLOOR, BALAJI CHAMBE GALI NO-10, VIKAS MARG, LAXMI NAGAR, EAST DELHI,']",IN,110092,"['D-246, OFFICE NO 301-302, 3RD FLOOR, BALAJI CHAMBE GALI NO-10, VIKAS MARG, LAXMI NAGAR, EAST DELHI,']",IN,110092,RA000394,U52399DL2016PTC308768,GENERAL,IN,ACTIVE,2024-10-14T08:49:19Z
335800AKPLOKKFKEAS94,PARMESHWARI JEWELEX INDIA PRIVATE LIMITED,N/A,N/A,"['C/O M/S PARMESHWARI JEWEL ART AJI GIDC, 80 FT RD PL 369/1', 'BH SARAL STOVE,']",IN,360002,"['C/O M/S PARMESHWARI JEWEL ART AJI GIDC, 80 FT RD PL 369/1', 'BH SARAL STOVE,']",IN,360002,RA000394,U36910GJ2022PTC128572,GENERAL,IN,ACTIVE,2024-08-26T11:43:31Z
335800AKTM24AF8V9B03,JALARAM CERAMICS LIMITED,N/A,N/A,"['511-512, ""SIROMANI"", 5TH FLOOR, OPP. OCEAN PARK, S.M.', 'ROAD, NR. NEHRUNAGAR CIRCLE']",IN,380015,"['511-512, ""SIROMANI"", 5TH FLOOR, OPP. OCEAN PARK, S.M.', 'ROAD, NR. NEHRUNAGAR CIRCLE']",IN,380015,RA000394,U26913GJ1995PLC024696,GENERAL,IN,ACTIVE,2022-04-29T10:15:50Z
335800AKR111UQBLIJ21,SHIV SHANKER TRADING COMPANY,N/A,N/A,"['NEAR BUS STAND,, BUNDI ROAD', 'CHITTORGARH']",IN,312022,"['NEAR BUS STAND,, BUNDI ROAD', 'CHITTORGARH']",IN,312022,RA000754,08ACFPL3374H1ZI,SOLE_PROPRIETOR,IN,ACTIVE,2024-08-29T09:35:31Z
335800AKPP3V6MJFCA42,ACRE-130-TRUST,N/A,N/A,"['2ND FLOOR, MOHAN DEV BUILDING', '13, TOLSTOY MARG']",IN,110001,"['2ND FLOOR, MOHAN DEV BUILDING', '13, TOLSTOY MARG']",IN,110001,RA999999,,GENERAL,IN,ACTIVE,2022-03-20T09:23:59Z
335800AKR1QP3NT9YS54,TECHNOCRAFT ENGINEERING,N/A,N/A,"['255/A, CHIRAVAKKAD, ERNAKULAM']",IN,683561,"['255/A, CHIRAVAKKAD, ERNAKULAM']",IN,683561,RA000754,32DKEPM6013C2ZQ,SOLE_PROPRIETOR,IN,ACTIVE,2019-06-04T12:11:37Z
335800AKXGPXQQ33S936,GRECKO INC.,N/A,N/A,"['2ND FLOOR, 264-265, WE WORK VASWANI CHAMBERS, DR ANNIE BESANT ROAD,', 'WORLI']",IN,400030,"['2ND FLOOR, 264-265, WE WORK VASWANI CHAMBERS, DR ANNIE BESANT ROAD,', 'WORLI']",IN,400030,RA000754,27CXOPP4102K1Z5,SOLE_PROPRIETOR,IN,ACTIVE,2022-11-18T09:51:59Z
335800AKXES7GW5EVN87,CALIBRE CONSULTANTS,N/A,N/A,"['9/5, CHINNIAH STREET, CHETPET,']",IN,600031,"['9/5, CHINNIAH STREET, CHETPET,']",IN,600031,RA000754,33AAAFC2007M1ZX,GENERAL,IN,ACTIVE,2021-09-08T07:13:24Z
335800AKYBQAABASLK40,R.K.AGENCIES,N/A,N/A,"['GROUND FLOOR, 28/10/19/9, MAIN ROAD, SURYABAGH, VISAKHAPATNAM, VISAKHAPATNAM, ANDHRA PRADESH,']",IN,530020,"['GROUND FLOOR, 28/10/19/9, MAIN ROAD, SURYABAGH, VISAKHAPATNAM, VISAKHAPATNAM, ANDHRA PRADESH,']",IN,530020,RA000754,37AGCPM0799G3Z4,SOLE_PROPRIETOR,IN,ACTIVE,2024-12-10T09:11:07Z
335800AKRSQO1TFDGY63,SATYENDRA FIBC PRIVATE LIMITED,335800BLP4E91ZMHZE25,SATYENDRA PACKAGING LIMITED,"['SURVEY NO.1469/1, RASNOL ROAD', 'OPP. POSHAK FACTORY', 'SARSA']",IN,388365,"['SURVEY NO.1469/1, RASNOL ROAD', 'OPP. POSHAK FACTORY', 'SARSA']",IN,388365,RA000394,U25199GJ2017PTC100252,GENERAL,IN,ACTIVE,2021-01-20T12:18:21Z
335800AKWRJD5XEU1445,RAJPROTIM LOGISTICS PRIVATE LIMITED,N/A,N/A,"['49/89', 'PRINCE GULAM MD. ROAD']",IN,700033,"['49/89', 'PRINCE GULAM MD. ROAD']",IN,700033,RA000394,U60231WB2010PTC145130,GENERAL,IN,ACTIVE,2022-05-05T14:24:10Z
335800AKYMSIHNI2OS90,GREENKO SOLAR ENERGY PRIVATE LIMITED,N/A,N/A,"['THIRD FLOOR, BLOCK D, PLOT NO.13, SY. NO. 64 PART HITECH CITY LAYOUT', 'MADHAPUR VILLAGE, HYDERABAD RANGAREDDI TG IN']",IN,500081,"['THIRD FLOOR, BLOCK D, PLOT NO.13, SY. NO. 64 PART HITECH CITY LAYOUT', 'MADHAPUR VILLAGE, HYDERABAD RANGAREDDI TG IN']",IN,500081,RA000394,U40108TG2010PTC067974,GENERAL,IN,ACTIVE,2019-05-29T12:44:44Z
335800AKQKMM8F3ARF27,KANAKIA GRUHNIRMAN PRIVATE LIMITED,3358003MDE12VNQR2V50,KANAKIA SPACES PRIVATE LIMITED,"['A WING, GROUND FLOOR, VILCO CENTRE,SUBHASH ROAD, OPP GARWARE, VILEPARLE (EAST), MUMBAI, MUMBAI, MAHA']",IN,400057,"['A WING, GROUND FLOOR, VILCO CENTRE,SUBHASH ROAD, OPP GARWARE, VILEPARLE (EAST), MUMBAI, MUMBAI, MAHA']",IN,400057,RA000394,U45200MH1995PTC089789,GENERAL,IN,ACTIVE,2018-05-10T13:15:36Z
335800AKYZQP3QJDBO43,PALLICKAL ESTHAPPANOSE MARTIN,N/A,N/A,"['132-E, PALLICKAL FOOD PRODUCTS', 'KOLLAMKODE, AYYAMPUZHA,']",IN,683581,"['132-E, PALLICKAL FOOD PRODUCTS', 'KOLLAMKODE, AYYAMPUZHA,']",IN,683581,RA000754,32ADWPM1738L1Z2,SOLE_PROPRIETOR,IN,ACTIVE,2024-09-19T06:09:44Z
335800AL216H643IST22,SHREE GOPINATHJI MOTORS PRIVATE LIMITED,N/A,N/A,"['A/3 SAHJANAND INDUSTRIAL ESTATE MUNJMAHUDA, VADODARA']",IN,390020,"['A/3 SAHJANAND INDUSTRIAL ESTATE MUNJMAHUDA, VADODARA']",IN,390020,RA000394,U50400GJ2018PTC103004,GENERAL,IN,ACTIVE,2023-03-01T12:33:24Z
335800AKYZSTBCGXNG24,GALA PROJECTS LLP,N/A,N/A,"['A-1, 9TH FLOOR, SAFAL PROFITAIRE', 'CORPORATE ROAD, PRAHLADNAGAR,', 'OFF S. G. ROAD, AHMEDABAD', 'AHMEDABAD']",IN,380015,"['A-1, 9TH FLOOR, SAFAL PROFITAIRE', 'CORPORATE ROAD, PRAHLADNAGAR,', 'OFF S. G. ROAD, AHMEDABAD', 'AHMEDABAD']",IN,380015,RA000394,AAB-4106,GENERAL,IN,ACTIVE,2020-01-20T12:34:15Z
335800AL2VHGY74U7P05,RAJ INTERNATIONAL,N/A,N/A,"['10 GIDC , RAILWAY STATION ROAD ,DEESA']",IN,385535,"['10 GIDC , RAILWAY STATION ROAD ,DEESA']",IN,385535,RA000754,24AAXFR3297B1ZV,GENERAL,IN,ACTIVE,2018-06-28T13:51:58Z
335800AKZY2HA3KYVQ90,OMKAR DEVELOPERS,N/A,N/A,"['3RD FLOOR, 304-305, HIR ASHA SQUARE,', 'SARDAR PATEL RING ROAD, SCIENCE CITY CIRCLE,', 'BHADAJ,']",IN,382722,"['3RD FLOOR, 304-305, HIR ASHA SQUARE,', 'SARDAR PATEL RING ROAD, SCIENCE CITY CIRCLE,', 'BHADAJ,']",IN,382722,RA000754,24AAHFO8645G1Z2,GENERAL,IN,ACTIVE,2024-04-05T12:20:25Z
335800AL48EDVG76WU70,RIA HOTELS PRIVATE LIMITED,N/A,N/A,"['11TH FLOOR, C21 BUSINESS PARK C21 SQUARE,', 'OPPOSITE RADISSON BLU HOTEL MR-10']",IN,452001,"['11TH FLOOR, C21 BUSINESS PARK C21 SQUARE,', 'OPPOSITE RADISSON BLU HOTEL MR-10']",IN,452001,RA000394,U55101MP2006PTC018891,GENERAL,IN,ACTIVE,2023-05-03T08:51:20Z
335800AL26JCO7AWKK77,MM POLYMER INDUSTRIES,N/A,N/A,"['MAIN ROAD, AHEAD OF SHANKARACHARYA', 'COLLEGE, OLD DHAMTARI ROAD, VILLAGE', 'CHHACHHANPAIRI TEHSIL ABHANPUR']",IN,493661,"['MAIN ROAD, AHEAD OF SHANKARACHARYA', 'COLLEGE, OLD DHAMTARI ROAD, VILLAGE', 'CHHACHHANPAIRI TEHSIL ABHANPUR']",IN,493661,RA000754,22ABJFM5317J1ZA,GENERAL,IN,ACTIVE,2022-04-19T12:21:55Z
335800AL4CHQO2W85L19,ALBA TITANIA,N/A,N/A,"['106 J / 54, PALAI ROAD WEST, MILLERPURAM']",IN,628002,"['106 J / 54, PALAI ROAD WEST, MILLERPURAM', 'NO 37']",IN,628002,RA000754,33ABZFA4988K1ZI,GENERAL,IN,ACTIVE,2024-06-19T12:30:49Z
335800AKZBJFKJTEGU38,GURGAON-PALWAL TRANSMISSION LIMITED,N/A,N/A,"['UNITNO 101,FIRST FLOOR,WINDSOR VILLAGE,KOLEKALYAN OFF CST', 'ROAD, VIDYANAGARI MARG,SANTACRUZ(EAST']",IN,400055,"['UNITNO 101,FIRST FLOOR,WINDSOR VILLAGE,KOLEKALYAN OFF CST', 'ROAD, VIDYANAGARI MARG,SANTACRUZ(EAST']",IN,400055,RA000394,U40300MH2015GOI363587,GENERAL,IN,ACTIVE,2018-11-01T12:12:22Z
335800AKZFW2WZ2ZPF58,MI LIFESTYLE MARKETING GLOBAL PRIVATE LIMITED,N/A,N/A,"['2ND FLOOR, LANCO HOUSE, NO. 25, G. N. CHETTY ROAD, T. NAGAR,']",IN,600017,"['2ND FLOOR, LANCO HOUSE, NO. 25, G. N. CHETTY ROAD, T. NAGAR,']",IN,600017,RA000394,U74999TN2013PTC090049,GENERAL,IN,ACTIVE,2023-03-17T11:05:12Z
335800AL4QPSIFSU3936,VISHAL MEGA MART LIMITED,N/A,N/A,"['PLOT NO. 184', 'PHASE-1', 'FIFTH FLOOR, PLATINUM TOWER UDYOG VIHAR']",IN,122016,"['PLOT NO. 184', 'PHASE-1', 'FIFTH FLOOR, PLATINUM TOWER UDYOG VIHAR']",IN,122016,RA000394,U51909HR2018PLC073282,GENERAL,IN,ACTIVE,2021-01-15T10:54:35Z
335800AL5EIRPWHMSY54,ECLERX SERVICES LIMITED,N/A,N/A,"['SONAWALLA BUILDING1ST FLOOR', '29 BANK S FORT MUMBAI', 'MUMBAI']",IN,400023,"['SONAWALLA BUILDING1ST FLOOR', '29 BANK S FORT MUMBAI', 'MUMBAI']",IN,400023,RA000394,L72200MH2000PLC125319,GENERAL,IN,ACTIVE,2017-08-09T10:33:59Z
335800AL5QJV39FDTZ94,ROSTRUM REALTY PRIVATE LIMITED,N/A,N/A,"['AIRTEL CENTRE, PLOT NO. 16, UDYOG VIHAR, PHASE-IV GURUGRAM GURGAON HR IN']",IN,122015,"['AIRTEL CENTRE, PLOT NO. 16, UDYOG VIHAR, PHASE-IV GURUGRAM GURGAON HR IN']",IN,122015,RA000394,U70109HR2021PTC098965,GENERAL,IN,ACTIVE,2023-06-13T09:01:36Z
335800AL7SRRL7CO1L67,HDFC FMP 1133D FEBRUARY 2019 (1),N/A,N/A,"['2ND FLOOR HDFC HOUSE', 'H T PAREKH MARG', '165-166 BACKBAY RECLAMATION', 'CHURCHGATE MUMBAI']",IN,400020,"['C/O HDFC ASSET MANAGEMENT COMPANY LIMITED 2ND FLOOR HDFC HOUSE', 'H T PAREKH MARG', '165-166 BACKBAY RECLAMATION', 'CHURCHGATE MUMBAI']",IN,400020,RA000708,INF179KC1452,FUND,IN,INACTIVE,2019-04-24T14:36:07Z
