LEI,Legal Name,Parent LEI,Parent Name,Legal Address,Legal City,Legal Postal Code,HQ Address,HQ City,HQ Postal Code,Registration ID,Registered As,Category,Legal Jurisdiction,Entity Status,Registration Date
300300330M590JILVU15,成都高速公路股份有限公司,N/A,N/A,['成都市高新区科新路1号'],CN,100000,['成都市高新区科新路1号'],CN,100000,RA000092,91510100709239553X,GENERAL,CN,ACTIVE,2020-02-26T12:07:30Z
30030033DWOIGIXUVF85,深圳财富农场互联网金融服务有限公司,N/A,N/A,['深圳市南山区南山街道高新科技园南区德赛科技大厦21层'],CN,100000,['深圳市南山区南山街道高新科技园南区德赛科技大厦21层'],CN,100000,RA000092,91440300359493104A,GENERAL,CN,ACTIVE,2020-02-27T02:45:00Z
30030033G7PZOCK94J07,金好貿易(上海)有限公司,N/A,N/A,['虹橋路355號501-16室'],CN,200030,['虹梅路1905号208室'],CN,200233,RA000092,91310000671103190U,GENERAL,CN,ACTIVE,2017-09-08T05:23:19Z
3003003383R8OF7DQS47,广州鼎泰服装有限公司,N/A,N/A,['白云区石门街滘心旧庄大街2号代叔科创中心A栋617(自主申报)'],CN,510000,['白云区石门街滘心旧庄大街2号代叔科创中心A栋617(自主申报)'],CN,510000,RA000092,91440101MA59M50C6H,GENERAL,CN,ACTIVE,2019-10-28T06:34:49Z
30030033LW0ERITSA377,黔西南州兴安开发投资股份有限公司,N/A,N/A,['贵州省黔西南布依族苗族自治州兴义市顶效镇开发东路38号'],CN,550000,['贵州省黔西南布依族苗族自治州兴义市顶效镇开发东路38号'],CN,562400,RA000092,915223207705901236,GENERAL,CN,ACTIVE,2020-05-11T04:31:40Z
30030033MZ1SC9U3L837,雅高國際發展有限公司,N/A,N/A,['1201 12/F， TAI SANG BANK BUILDING 130-132 DES VOEUX ROAD CENTRAL'],HK,999077,['1201 12/F， TAI SANG BANK BUILDING 130-132 DES VOEUX ROAD CENTRAL'],HK,999077,RA000388,C1707396,GENERAL,HK,ACTIVE,2019-09-23T06:27:11Z
30030033MANHAJVFA586,宿迁云瀚信息科技有限公司,N/A,N/A,['宿迁市宿豫区洪泽湖东路19号恒通大厦416-429室-YS0008'],CN,100000,['宿迁市宿豫区洪泽湖东路19号恒通大厦416-429室-YS0008'],CN,100000,RA000092,91321311MA1P2KD34G,GENERAL,CN,ACTIVE,2020-03-28T05:10:37Z
30030033RZV26QSJPO89,太原市恒盛小额贷款有限公司,N/A,N/A,['太原市万柏林区长兴路1号3幢36层3607、3608号'],CN,100000,['太原市万柏林区长兴路1号3幢36层3607、3608号'],CN,100000,RA000092,911401095684638256,GENERAL,CN,ACTIVE,2020-04-26T03:22:08Z
30030033L781QNG1NG70,奇华顿食用香精香料（南通）有限公司,213800SVRMQA1TD91D41,GIVAUDAN SA,['经济技术开发区江海路7号'],CN,226017,['经济技术开发区江海路7号'],CN,226017,RA000092,91320691596922873C,GENERAL,CN,ACTIVE,2018-01-19T02:25:10Z
30030033T1QN6LXUUK62,锋睿国际（香港）有限公司,3003003B3HWW4VKZYK94,浙商中拓集团股份有限公司,['九龍尖沙咀東部科學館道14號新文華中心A座7樓704室'],HK,999077,['萧山区北干街道博奥路1658号浙商中拓总部大楼27楼2706'],CN,311203,RA000388,63731597,GENERAL,HK,ACTIVE,2018-09-21T00:34:29Z
30030033ZKYNB7NZQF35,北京商银科技有限公司,N/A,N/A,['北京市海淀区花园路甲13号院7号楼11层1106-1'],CN,100088,['北京市海淀区花园路甲13号院7号楼11层1106-1'],CN,100088,RA000092,9111010867663664X1,GENERAL,CN,ACTIVE,2019-03-27T07:02:43Z
30030033YJ6QO8J00W98,山东地矿股份有限公司,N/A,N/A,['山东省济南市高新区新宇路750号5号楼'],CN,100000,['山东省济南市高新区新宇路750号5号楼'],CN,100000,RA000092,91370000617780406F,GENERAL,CN,ACTIVE,2020-03-28T02:10:02Z
30030034AEQUP37AK889,天津城建集团有限公司,N/A,N/A,['天津市南开区鞍山西道260号'],CN,100000,['天津市南开区鞍山西道260号'],CN,100000,RA000092,911200007128085260,GENERAL,CN,ACTIVE,2020-03-25T07:55:18Z
300300343CALE05UFJ07,孝昌县顺和开发投资有限责任公司,N/A,N/A,['孝昌县花园大道120号'],CN,100000,['孝昌县花园大道120号'],CN,100000,RA000092,91420921784495194T,GENERAL,CN,ACTIVE,2020-05-12T05:51:00Z
300300342M4XNLZLMD95,北京卓宸畜牧有限公司,N/A,N/A,['北京市房山区良乡镇侯庄村东'],CN,100000,['北京市房山区良乡镇侯庄村东'],CN,100000,RA000092,911101111027499289,GENERAL,CN,ACTIVE,2020-05-24T02:43:49Z
30030033U00OVXVFYO02,祥泰发展有限公司,N/A,N/A,"['Portcullis TrustNet Chambers, P.O. Box 3444']",VG,VG1110,['九龙湾宏光道1号亿京中心B座21楼E室'],CN,999077,RA000063,1437743,GENERAL,VG,ACTIVE,2017-06-26T07:35:56Z
300300341GR123EQTC71,宝鸡高盛医疗用品有限公司,N/A,N/A,['陕西省宝鸡市眉县汤峪镇新联村十一组012号'],CN,710000,['陕西省宝鸡市眉县汤峪镇新联村十一组012号'],CN,710000,RA000092,916103265835446312,GENERAL,CN,ACTIVE,2020-07-20T02:12:14Z
3003003499QQOS7YGQ82,六福期貨(香港)有限公司,N/A,N/A,['皇后大道中183号中远大厦 22楼2201-2207 及 2213-2214室'],HK,999077,['皇后大道中183号中远大厦 22楼2201-2207 及 2213-2214室'],HK,999077,RA000389,58491716,GENERAL,HK,ACTIVE,2017-11-10T06:41:36Z
30030033WV20E49PWI57,中国海创控股国际有限公司,N/A,N/A,['Wickhams Cay II'],VG,VG1110,['九华南路1009号'],CN,241000,RA000063,1776361,GENERAL,VG,ACTIVE,2018-08-14T07:57:44Z
30030033TEHV82Q80D60,福建山普新材料有限公司,N/A,N/A,['福建省龙岩市武平县工业园区F08-09(武平县工业园区南二环路与新景路交汇处南侧)'],CN,350000,['福建省龙岩市武平县工业园区F08-09(武平县工业园区南二环路与新景路交汇处南侧)'],CN,350000,RA000092,91350800MA31JF104P,GENERAL,CN,ACTIVE,2020-08-17T00:12:46Z
30030034DZT71H3T6511,荣成市连海渔业有限公司,N/A,N/A,['荣成市石岛龙跃北路99号'],CN,264300,['荣成市石岛龙跃北路99号'],CN,264300,RA000092,913710827574859869,GENERAL,CN,ACTIVE,2020-09-08T00:19:28Z
30030034GAZL9GCFYM10,克拉玛依国民村镇银行有限责任公司,N/A,N/A,['治区克拉玛依市克拉玛依区塔河路67号'],CN,100000,['治区克拉玛依市克拉玛依区塔河路67号'],CN,100000,RA000092,91650200076053096N,GENERAL,CN,ACTIVE,2019-03-25T06:57:48Z
30030034ATVUX73EYI16,深圳市深业基建控股有限公司,N/A,N/A,['深圳市罗湖区桂园街道深南东路5002号信兴广场地王商业中心商业大楼2109-2116室'],CN,100000,['深圳市罗湖区桂园街道深南东路5002号信兴广场地王商业中心商业大楼2109-2116室'],CN,100000,RA000092,91440300676693599J,GENERAL,CN,ACTIVE,2020-05-11T05:57:42Z
30030034MZ1UO88CRH50,宿州市城市建设投资集团（控股）有限公司,N/A,N/A,['安徽省宿州市银河一路建委大厦'],CN,234000,['安徽省宿州市银河一路建委大厦'],CN,234000,RA000092,913413007373492661,GENERAL,CN,ACTIVE,2019-06-26T01:24:55Z
30030034ND5TRQPKND84,江苏银行股份有限公司淮安分行,N/A,N/A,['淮安市水渡口大道16号'],CN,100000,['淮安市水渡口大道16号'],CN,100000,RA000092,91320800735723699C,GENERAL,CN,ACTIVE,2020-01-22T04:34:53Z
30030034X80IWSDU3W76,新疆天山建材（集团）有限责任公司,N/A,N/A,['治区乌鲁木齐市新疆乌鲁木齐市水磨沟区安居南路802号鸿瑞豪庭3栋6层'],CN,100000,['治区乌鲁木齐市新疆乌鲁木齐市水磨沟区安居南路802号鸿瑞豪庭3栋6层'],CN,100000,RA000092,9165000071296510XP,GENERAL,CN,ACTIVE,2020-03-29T04:47:41Z
30030034ZYAFM2D3IY89,武汉光谷生物产业基地建设投资有限公司,N/A,N/A,['武汉市东湖新技术开发区高新大道666号生物创新园B11栋'],CN,100000,['武汉市东湖新技术开发区高新大道666号生物创新园B11栋'],CN,100000,RA000092,9142010067914929X7,GENERAL,CN,ACTIVE,2020-03-22T08:06:10Z
30030034OA405RZR7443,圣农发展（政和）有限公司,N/A,N/A,['福建省政和经济开发区同心路32号'],CN,350000,['福建省政和经济开发区同心路32号'],CN,350000,RA000092,91350000056138885L,GENERAL,CN,ACTIVE,2020-06-01T02:25:19Z
30030034P3SGJGA6BO08,中环香港发展有限公司,N/A,N/A,['湾仔骆克道301-307号洛克中心19楼C室'],HK,999077,['新技术产业园区华苑产业区（环外）海泰东路12号'],CN,300384,RA000388,68190380,GENERAL,HK,ACTIVE,2018-02-05T08:21:25Z
30030034V5RWRU9IRQ87,贵州省水利投资（集团）有限责任公司,N/A,N/A,['贵州省贵阳市观山湖区北京西路区人民政府办公楼26层81号'],CN,100000,['贵州省贵阳市观山湖区北京西路区人民政府办公楼26层81号'],CN,100000,RA000092,91520000584135266H,GENERAL,CN,ACTIVE,2020-02-03T03:01:55Z
30030034TNZ5SU6CVR28,武汉虹信通信技术有限责任公司,N/A,N/A,['洪山区邮科院路88号'],CN,430000,['洪山区邮科院路88号'],CN,430000,RA000092,91420100714508850F,GENERAL,CN,ACTIVE,2020-07-13T03:30:09Z
30030034Y5RLO3L5WS40,华泰柏瑞基金管理有限公司,N/A,N/A,['中国（上海）自由贸易试验区民生路1199弄上海证大五道口广场1号17层'],CN,200135,['中国（上海）自由贸易试验区民生路1199弄上海证大五道口广场1号17层'],CN,200135,RA000092,913100007178517770,GENERAL,CN,ACTIVE,2017-12-27T16:00:00Z
300300351S567GUY2Z30,宜昌平湖投资担保有限公司,N/A,N/A,['宜昌市夷陵区发展大道111号（夷陵商会）'],CN,100000,['宜昌市夷陵区发展大道111号（夷陵商会）'],CN,100000,RA000092,91420506737942799R,GENERAL,CN,ACTIVE,2020-04-26T06:58:27Z
30030034SYD9SV2N8G77,浙江兴泰农牧科技有限公司,N/A,N/A,['浙江省龙游县小南海镇龙丰村'],CN,310000,['浙江省龙游县小南海镇龙丰村'],CN,310000,RA000092,913308257664397114,GENERAL,CN,ACTIVE,2020-05-07T00:30:05Z
30030034TMOE5ILMDH97,帝斯曼江山制药（江苏）有限公司,N/A,N/A,['江苏省靖江市江山路'],CN,100000,['江苏省靖江市江山路'],CN,100000,RA000092,91321200608774282B,GENERAL,CN,ACTIVE,2020-05-13T07:06:11Z
30030035B2JS7ECG3447,江苏辰汉电子科技有限公司,N/A,N/A,['苏州工业园区华云路1号东坊产业园C区5号楼3楼南侧'],CN,215000,['苏州工业园区华云路1号东坊产业园C区5号楼3楼南侧'],CN,215000,RA000092,913205940727712937,GENERAL,CN,INACTIVE,2020-08-12T00:26:36Z
30030035G3WO25RH3565,华致酒行连锁管理股份有限公司,N/A,N/A,['云南省迪庆州香格里拉经济开发区中心片区'],CN,650000,['云南省迪庆州香格里拉经济开发区中心片区'],CN,650000,RA000092,915300007755009087,GENERAL,CN,ACTIVE,2020-08-11T00:25:34Z
3003003568EMKS9XXI47,泉州市保华保险代理有限公司,N/A,N/A,['泉州市丰泽区东湖街道湖心街342号礼景楼502室'],CN,100000,['泉州市丰泽区东湖街道湖心街342号礼景楼502室'],CN,100000,RA000092,913505037617808229,GENERAL,CN,ACTIVE,2020-04-25T01:32:46Z
300300354OCE7XVO2493,新疆中泰纺织集团有限公司,N/A,N/A,['治区巴音郭楞蒙古自治州新疆巴州库尔勒经济技术开发区218国道东侧、库塔干渠北侧'],CN,100000,['治区巴音郭楞蒙古自治州新疆巴州库尔勒经济技术开发区218国道东侧、库塔干渠北侧'],CN,100000,RA000092,916528016636451173,GENERAL,CN,ACTIVE,2020-02-22T08:03:23Z
300300358PAP55XXDT86,中轻新世纪贸易发展有限公司,N/A,N/A,['北京市朝阳区劲松九区910楼'],CN,100000,['北京市朝阳区劲松九区910楼'],CN,100000,RA000092,91110000710934641L,GENERAL,CN,ACTIVE,2020-01-22T04:35:52Z
30030035Y4GF2NSME969,六安农村商业银行股份有限公司,N/A,N/A,['金安区皖西路32号'],CN,100000,['金安区皖西路32号'],CN,100000,RA000092,91341500X105986081,GENERAL,CN,ACTIVE,2019-04-03T05:51:28Z
30030035X92QA3KXDQ61,"BAIC Finance Investment Co., Ltd.",N/A,N/A,['威克罕斯湾二号里特大厦'],VG,VG1110,['双河大街99号'],CN,101300,RA000063,1869457,GENERAL,VG,ACTIVE,2018-07-25T16:00:00Z
30030035R5S9VQO4BL41,山东泉林秸秆综合利用有限公司,N/A,N/A,['高唐县人和街道光明东路15号'],CN,100000,['高唐县人和街道光明东路15号'],CN,100000,RA000092,913715265992885992,GENERAL,CN,ACTIVE,2020-03-20T05:31:25Z
30030035O072MEH6UA32,香港資產管理有限公司,N/A,N/A,"['Rooms 105-7, 1/F.', ""St George's Building"", '2 Ice House Street']",HK,999077,"['Rooms 105-7, 1/F.', ""St George's Building"", '2 Ice House Street']",HK,999077,RA000389,15766132,GENERAL,HK,ACTIVE,2019-05-07T07:31:59Z
300300360CZWFYICN784,合肥布诺太阳能科技有限公司,N/A,N/A,['合肥市蜀山区新产业园汶水路电商园三期'],CN,230000,['合肥市蜀山区新产业园汶水路电商园三期'],CN,230000,RA000092,91340100062468266W,GENERAL,CN,ACTIVE,2019-10-28T01:51:47Z
300300361LZOGM6G2X94,甘肃合睿律师事务所,N/A,N/A,['兰州市高新区飞雁街116号陇星大厦1号楼14层'],CN,100000,['兰州市高新区飞雁街116号陇星大厦1号楼14层'],CN,100000,RA000092,31620000H17105662X,GENERAL,CN,ACTIVE,2020-06-17T05:42:02Z
30030035NPU8F1JWNI30,美迪科（上海）包装材料有限公司,N/A,N/A,['上海市奉贤区奉城镇奉坚路233号'],CN,200000,['上海市奉贤区奉城镇奉坚路233号'],CN,200000,RA000092,91310120751495665U,GENERAL,CN,ACTIVE,2020-08-20T06:25:05Z
30030035RGVGWTNI9Z22,华电漯河发电有限公司,N/A,N/A,['漯河经济开发区漯上路东段'],CN,450000,['漯河经济开发区漯上路东段'],CN,450000,RA000092,9141110068076402X2,GENERAL,CN,ACTIVE,2020-06-19T01:46:49Z
30030035YMQN6Q9I7Q49,浙江青莲食品股份有限公司,N/A,N/A,['浙江省嘉兴市海盐县望海街道集镇镇北'],CN,310000,['浙江省嘉兴市海盐县望海街道集镇镇北'],CN,310000,RA000092,91330400732418541A,GENERAL,CN,ACTIVE,2020-06-01T07:17:06Z
30030035ZDVH4DLW2239,聊城市财金建设发展有限公司,N/A,N/A,['东昌府区东昌西路119号'],CN,100000,['东昌府区东昌西路119号'],CN,100000,RA000092,91371500MA3C8QBK10,GENERAL,CN,ACTIVE,2018-04-10T08:10:15Z
300300365EUZ8X7NWE40,东莞斯道拉恩索正元包装有限公司,N/A,N/A,['高埗镇莞潢中路冼沙桥西'],CN,523000,['高埗镇莞潢中路冼沙桥西'],CN,523000,RA000092,91441900677104055U,GENERAL,CN,ACTIVE,2018-10-18T06:45:22Z
3003003631P3BQOCH698,兰州佛慈制药股份有限公司,N/A,N/A,['甘肃省兰州市兰州新区华山路2289号'],CN,730000,['甘肃省兰州市兰州新区华山路2289号'],CN,730000,RA000092,91620000712762468N,GENERAL,CN,ACTIVE,2020-07-13T03:30:52Z
300300363A5RM86K5111,十堰百兴消毒制品有限公司,N/A,N/A,['湖北省十堰市张湾区工业新区阳光大道18号1幢(1-2)-1'],CN,430000,['湖北省十堰市张湾区工业新区阳光大道18号1幢(1-2)-1'],CN,430000,RA000092,91420300757002489L,GENERAL,CN,ACTIVE,2020-08-13T06:05:25Z
300300362JN63519J240,南通市港闸区国有资产经营有限公司,N/A,N/A,['江苏省南通市港闸区城港路58号9楼'],CN,100000,['江苏省南通市港闸区城港路58号9楼'],CN,100000,RA000092,91320600742459953N,GENERAL,CN,ACTIVE,2020-02-09T02:51:15Z
300300362PQYPGQWQB03,南陵太平村镇银行股份有限公司,N/A,N/A,['南陵县籍山中路南陵中央商业广场（中端）9号楼121号'],CN,241300,['南陵县籍山中路南陵中央商业广场（中端）9号楼121号'],CN,241300,RA000092,913402003279367912,GENERAL,CN,ACTIVE,2019-04-02T01:50:59Z
30030036AFTTOTJGPA36,湘乡市城市建设投资开发有限公司,N/A,N/A,['湖南省湘乡市东山办事处东山村'],CN,100000,['湖南省湘乡市东山办事处东山村'],CN,100000,RA000092,914303810538532690,GENERAL,CN,ACTIVE,2020-02-08T07:05:08Z
30030036EGJFC01Q8074,浙江新安化工集团股份有限公司,N/A,N/A,['浙江省建德市新安江镇'],CN,100000,['浙江省建德市新安江镇'],CN,100000,RA000092,913300001429192743,GENERAL,CN,ACTIVE,2020-03-26T13:32:15Z
30030036G9NCM6433161,耿马傣族佤族自治县农村信用合作联社,N/A,N/A,['耿马县耿马镇建设路233号'],CN,677500,['耿马县耿马镇建设路233号'],CN,677500,RA000092,915309262196210476,GENERAL,CN,ACTIVE,2019-03-25T02:07:15Z
30030036IFOXLK9MFO85,四川金手指服装有限公司,N/A,N/A,['四川省巴中市南江县正直镇大店子街110、112、114、116号'],CN,610000,['四川省巴中市南江县正直镇大店子街110、112、114、116号'],CN,610000,RA000092,91511922MA64D5AMXK,GENERAL,CN,INACTIVE,2020-07-16T06:52:25Z
30030036AT2Q8OWZQA89,江苏庆源律师事务所,N/A,N/A,['江苏省无锡市新吴区湘江路2-3号金源大厦A座1906-1907'],CN,100000,['江苏省无锡市新吴区湘江路2-3号金源大厦A座1906-1907'],CN,100000,RA000092,31320000570320217N,GENERAL,CN,ACTIVE,2020-06-17T01:56:19Z
30030036F5QBH4ZSB608,江苏海州发展集团有限公司,N/A,N/A,['市连云港市海州区新浦经济开发区长江路1号'],CN,100000,['市连云港市海州区新浦经济开发区长江路1号'],CN,100000,RA000092,913207007500035505,GENERAL,CN,ACTIVE,2020-02-03T04:15:09Z
30030036HVWUZN5LNF89,乌鲁木齐房地产开发（集团）有限公司,N/A,N/A,['治区乌鲁木齐市新疆乌鲁木齐市水磨沟区会展大道599号新纪元广场（新疆财富中心）C座）'],CN,100000,['治区乌鲁木齐市新疆乌鲁木齐市水磨沟区会展大道599号新纪元广场（新疆财富中心）C座）'],CN,100000,RA000092,9165010077605978XA,GENERAL,CN,ACTIVE,2020-03-25T08:16:00Z
30030036F8HPKYIC2641,斯道拉恩索（广西）浆纸有限公司,N/A,N/A,['铁山港区兴港镇港中路188号'],CN,536000,['中国广西壮族自治区铁山港区兴港镇港中路188号'],CN,536000,RA000092,91450500090707025M,GENERAL,CN,ACTIVE,2017-10-27T02:57:31Z
300300368FLFXB57EQ05,府谷县国有资产运营有限责任公司,N/A,N/A,['陕西省榆林市府谷县新区财税中心九楼'],CN,100000,['陕西省榆林市府谷县新区财税中心九楼'],CN,100000,RA000092,91610822762582246Q,GENERAL,CN,ACTIVE,2020-05-15T03:55:37Z
3003003692GEID6JL919,Gauri Shankar Investment Limited,N/A,N/A,"['SUITE 3101, EVERBRIGHT CENTRE 108 GLOUCESTER ROAD, WANCHAI']",HK,999077,['湾仔告士打道108号光大中心3101室'],HK,999077,RA000388,71740752,GENERAL,HK,ACTIVE,2020-08-05T06:23:44Z
30030036JVSKTX4GPW28,香港完美国际有限公司,N/A,N/A,['香港湾仔轩尼诗道145号安康商业大厦13楼02室'],HK,999077,['香港湾仔轩尼诗道145号安康商业大厦13楼02室'],HK,999077,RA000389,31433199,GENERAL,HK,ACTIVE,2017-11-24T01:30:16Z
30030036NSVJMMZH8582,哈尔滨誉衡集团有限公司,N/A,N/A,['滨市哈尔滨高新技术产业开发区高科技创业中心南岗26号楼红旗大街180号532室'],CN,100000,['滨市哈尔滨高新技术产业开发区高科技创业中心南岗26号楼红旗大街180号532室'],CN,100000,RA000092,91230199665661516L,GENERAL,CN,ACTIVE,2020-03-25T12:48:36Z
30030036R4MYD8C7OU44,广东恒健投资控股有限公司,N/A,N/A,['广东省广州市越秀区天河路45号恒健大厦15楼'],CN,100000,['广东省广州市越秀区天河路45号恒健大厦15楼'],CN,100000,RA000092,91440000787926455P,GENERAL,CN,ACTIVE,2020-03-24T04:08:38Z
30030036MTFSBIDCHI84,上海信而富企业管理有限公司,N/A,N/A,['上海市嘉定区南翔镇银翔路819弄1号7层705室'],CN,100000,['上海市嘉定区南翔镇银翔路819弄1号7层705室'],CN,100000,RA000092,913100007776054479,GENERAL,CN,ACTIVE,2020-02-26T13:28:01Z
30030036R53SLJS5FF57,广东水电二局股份有限公司,N/A,N/A,['广东省广州市增城区新塘镇广深大道西1号1幢水电广场A-1商务中心20层'],CN,100000,['广东省广州市增城区新塘镇广深大道西1号1幢水电广场A-1商务中心20层'],CN,100000,RA000092,914400007349924088,GENERAL,CN,ACTIVE,2020-03-04T08:01:40Z
30030036UUVNYE4GNU53,黑龙江鼎元药业股份有限公司,N/A,N/A,['黑龙江省大庆市大同工业园区同福路南侧东干线东侧'],CN,150000,['黑龙江省大庆市大同工业园区同福路南侧东干线东侧'],CN,150000,RA000092,91230600MA1AWFTR9X,GENERAL,CN,ACTIVE,2020-07-21T06:03:39Z
30030036SNSCJI6X0S31,杭州昱鼎生物科技有限公司,N/A,N/A,['浙江省杭州市萧山区传化科创大厦1幢萧山科技城310-50室'],CN,310000,['浙江省杭州市萧山区传化科创大厦1幢萧山科技城310-50室'],CN,310000,RA000092,91330109MA2AXRQY7N,GENERAL,CN,ACTIVE,2020-08-13T05:40:35Z
300300370CIXBA8WMA09,华商林李黎（前海）联营律师事务所,N/A,N/A,['深圳市前海区深港现代服务业合作区前海企业公馆3栋1层B单元'],CN,100000,['深圳市前海区深港现代服务业合作区前海企业公馆3栋1层B单元'],CN,100000,RA000092,3144000031949070XJ,GENERAL,CN,ACTIVE,2020-06-16T07:30:14Z
300300374Y492YOJBN88,苏州群睿信息科技有限公司,N/A,N/A,['苏州工业园区唯新路91号中旭鑫科技园1号楼0507室'],CN,215000,['苏州工业园区唯新路91号中旭鑫科技园1号楼0507室'],CN,215000,RA000092,91320594557066410Y,GENERAL,CN,ACTIVE,2020-08-12T00:13:54Z
300300377REMORAPZB55,烟台海基置业有限公司,N/A,N/A,['山东省龙口市徐福镇驻地'],CN,100000,['山东省龙口市徐福镇驻地'],CN,100000,RA000092,91370681670512857U,GENERAL,CN,ACTIVE,2020-01-22T05:37:02Z
30030036VL0L6ME4P766,华仪集团有限公司,N/A,N/A,['浙江省乐清经济开发区中心大道228号'],CN,100000,['浙江省乐清经济开发区中心大道228号'],CN,100000,RA000092,91330382145555891G,GENERAL,CN,ACTIVE,2020-03-26T12:26:52Z
300300375BSU61TMU714,香港一联科技有限公司,N/A,N/A,['香港上环永乐街116-118号昌新大厦3楼A室'],HK,999077,['香港上环永乐街116-118号昌新大厦3楼A室'],HK,999077,RA000389,60907066,GENERAL,HK,ACTIVE,2018-08-14T07:56:11Z
30030036W5MV7Q2BOU89,青海联合信用管理有限公司,N/A,N/A,['西宁市城中区北大街26号（天桥商务大厦10层）'],CN,100000,['西宁市城中区北大街26号（天桥商务大厦10层）'],CN,100000,RA000092,916301035649299152,GENERAL,CN,ACTIVE,2019-11-20T08:05:47Z
30030037110200005458,山东明月食品有限公司,N/A,N/A,['开发区北京路227号鲁南航贸中心B座1202'],CN,100000,['开发区北京路227号鲁南航贸中心B座1202'],CN,100000,RA000092,913711007424385116,GENERAL,CN,ACTIVE,2020-09-18T07:16:55Z
30030036SA7PNYVDJ823,源廬國際有限公司,N/A,N/A,['湾仔区洛克哈特路300号侨阜商业大厦A座20楼'],HK,999077,['真光路1219号19楼'],CN,200333,RA000388,64858027,GENERAL,HK,ACTIVE,2017-11-19T16:00:00Z
30030037CFL2646SQG15,烟台鹏晖铜业有限公司,N/A,N/A,['山东省烟台市芝罘区楚凤三街3号'],CN,100000,['山东省烟台市芝罘区楚凤三街3号'],CN,100000,RA000092,913706006134105047,GENERAL,CN,ACTIVE,2020-05-08T23:50:24Z
300300377WGIRLRA0N38,Cedrus International Limited,N/A,N/A,['中環皇后大道中8號6樓'],HK,999077,['中環皇后大道中8號6樓'],HK,999077,RA000388,64016970,GENERAL,HK,ACTIVE,2017-05-08T08:33:45Z
30030037866EKZ507P47,五洲丰农业科技有限公司,N/A,N/A,['山东省烟台市芝罘区华盛路20号'],CN,100000,['山东省烟台市芝罘区华盛路20号'],CN,100000,RA000092,91370600729284802J,GENERAL,CN,ACTIVE,2020-01-22T06:14:52Z
30030037CEJ566FNJS22,金风国际控股（香港）有限公司,N/A,N/A,['香港铜锣湾礼顿道9-11号诚信大厦17楼1701室'],CN,999077,['经济技术开发区博兴一路8号智慧能源大厦3层'],CN,100176,RA000388,C1511986,GENERAL,HK,ACTIVE,2017-11-20T16:00:00Z
30030037E0BG2T5A4N11,中铁二局集团有限公司,N/A,N/A,['成都市金牛区通锦路16号'],CN,100000,['成都市金牛区通锦路16号'],CN,100000,RA000092,91510100MA61RKR7X3,GENERAL,CN,ACTIVE,2020-02-07T05:03:21Z
30030037FHGIWPX70U93,苏州风物资产管理有限公司,N/A,N/A,['苏州工业园区万盛街28号星海国际大厦12楼111室'],CN,215128,['苏州工业园区万盛街28号星海国际大厦12楼111室'],CN,215128,RA000092,91320594MA1N24BU7D,GENERAL,CN,ACTIVE,2020-01-03T03:18:17Z
30030037GI80SRAJAK10,富智康集团有限公司,N/A,N/A,"['Grand Pavilion,Hibiscus Way,802 West Bay Road']",KY,KY1-1100,['廊坊经济技术开发区'],CN,065000,RA000086,96800,GENERAL,KY,ACTIVE,2017-12-20T16:00:00Z
30030037NLFZTV4FK361,中国华电科工集团有限公司,N/A,N/A,['北京市丰台区汽车博物馆东路6号院1号楼'],CN,100000,['北京市丰台区汽车博物馆东路6号院1号楼'],CN,100000,RA000092,911100001000114958,GENERAL,CN,ACTIVE,2020-03-25T12:36:10Z
30030037O4HFY3J7P830,北京华瑞富达科技有限公司,N/A,N/A,['崇外大街11号705'],CN,100000,['崇外大街11号705'],CN,100000,RA000092,91110102663148727E,GENERAL,CN,ACTIVE,2019-03-21T09:03:41Z
30030037KL2YP3D34978,中建三局集团有限公司,N/A,N/A,['武汉市关山路552号'],CN,100000,['武汉市关山路552号'],CN,100000,RA000092,91420000757013137P,GENERAL,CN,ACTIVE,2020-02-07T04:07:36Z
30030037QNBZEWNAFH62,印度国家银行上海分行,N/A,N/A,['淮海中路1010号嘉华中心4206室'],CN,100000,['淮海中路1010号嘉华中心4206室'],CN,100000,RA000092,91310000785887448K,GENERAL,CN,ACTIVE,2019-03-29T07:33:25Z
30030037I9KN60AXIR87,贵州铁路投资有限责任公司,N/A,N/A,['贵州省贵阳市云岩区瑞金中路77号“百灵时尚天地”17楼'],CN,100000,['贵州省贵阳市云岩区瑞金中路77号“百灵时尚天地”17楼'],CN,100000,RA000092,91520000680183858K,GENERAL,CN,ACTIVE,2020-03-28T05:23:47Z
30030037RRQ2JELSOR74,君华集团（香港）有限公司,N/A,N/A,['九龙尖沙咀梳士巴利道18号K11 Atelier 1701单元'],HK,999077,['九龙尖沙咀梳士巴利道18号K11 Atelier 1701单元'],HK,999077,RA000388,68201250,GENERAL,HK,ACTIVE,2018-01-18T16:00:00Z
30030037SY8L5T5MBT25,安徽联河股份有限公司,N/A,N/A,['安徽省安庆市望江县经济开发区'],CN,230000,['安徽省安庆市望江县经济开发区'],CN,230000,RA000092,91340827732997715F,GENERAL,CN,ACTIVE,2020-05-07T01:18:20Z
